tipo,latitude,longitude,bright,date,admin2,admin3,country_code,country_es
48h,46.7571,31.24964,343.39,15 de agosto,"Comunidad de la aldea de Koblivska, distrito de Mykolaiv, región de Mykolaiv, Ucrania",,,
48h,47.14628,32.62955,334.55,15 de agosto,"Comunidad rural de Shirokivska, distrito de Bashtansky, región de Mykolaiv, Ucrania",,,
48h,46.62169,30.3568,339.18,15 de agosto,"Wind Street, Novodmitrivka Driver, Razdelnyansk City Community, Razdelnyansky District, Región de Odesa, 67472, Ucrania",,,
48h,46.62028,30.35198,338.01,15 de agosto,"Wind Street, Novodmitrivka Driver, Razdelnyansk City Community, Razdelnyansky District, Región de Odesa, 67472, Ucrania",,,
48h,47.28934,32.65864,344.87,15 de agosto,"Comunidad de la ciudad de Bashtansk, distrito de Bashtansky, región de Mykolaiv, Ucrania",,,
48h,46.62296,30.35433,339.88,15 de agosto,"Wind Street, Novodmitrivka Driver, Razdelnyansk City Community, Razdelnyansky District, Región de Odesa, 67472, Ucrania",,,
48h,46.62154,30.34956,335.14,15 de agosto,"Novodmitrivka Friend, Razdelnyansk City Community, Razdelnyansky District, Región de ODESA, 67472, Ucrania",,,
48h,47.28885,32.66011,330.37,15 de agosto,"Comunidad de la ciudad de Bashtansk, distrito de Bashtansky, región de Mykolaiv, Ucrania",,,
48h,47.29341,32.65748,347.36,15 de agosto,"Comunidad de la ciudad de Bashtansk, distrito de Bashtansky, región de Mykolaiv, Ucrania",,,
48h,47.77504,33.89013,337.87,15 de agosto,"Comunidad de la Ciudad Apostólica, Distrito Kryvyi Rih, Región Dnipropetrovsk, Ucrania",,,
48h,47.93026,34.43641,336.01,15 de agosto,"Comunidad de la aldea de Pershotravnevsk, distrito de Nikopol, región de Dnipropetrovsk, Ucrania",,,
48h,47.92875,34.43029,337.71,15 de agosto,"Comunidad de la aldea de Pershotravnevsk, distrito de Nikopol, región de Dnipropetrovsk, Ucrania",,,
48h,47.35322,31.79715,338.35,15 de agosto,"La comunidad de Novo Odessa City, distrito de Mykolaiv, región de Mykolaiv, Ucrania",,,
48h,47.35902,31.79836,367,15 de agosto,"La comunidad de Novo Odessa City, distrito de Mykolaiv, región de Mykolaiv, Ucrania",,,
48h,47.35794,31.79444,367,15 de agosto,"La comunidad de Novo Odessa City, distrito de Mykolaiv, región de Mykolaiv, Ucrania",,,
48h,47.81241,33.10537,354.17,15 de agosto,"O-042104, Green Balka, Novolatovsk Village Community, Distrito de Kryvyi Rih, región de Dnipropetrovsk, 53710, Ucrania",,,
48h,47.81861,33.10979,367,15 de agosto,"O-042104, Green Balka, Novolatovsk Village Community, Distrito de Kryvyi Rih, región de Dnipropetrovsk, 53710, Ucrania",,,
48h,47.81681,33.10284,337.45,15 de agosto,"O-042104, Green Balka, Novolatovsk Village Community, Distrito de Kryvyi Rih, región de Dnipropetrovsk, 53710, Ucrania",,,
48h,47.24283,30.39016,345.83,15 de agosto,"Petrovirivska Village Community, distrito de Berezovsky, región de Odesa, Ucrania",,,
48h,47.2478,30.38704,330.08,15 de agosto,"O-162645, Petrovirivka, Petrovirivska Rural Community, Berezovsky District, Región de ODESA, 66860, Ucrania",,,
48h,48.23342,33.95612,330.21,15 de agosto,"Embankment Street, Polyana, Comunidad de la Ciudad de Bozhadariv, Distrito de Kamyansky, región de Dnipropetrovsk, 52350, Ucrania",,,
48h,47.60261,30.45017,338.55,15 de agosto,"Comunidad de asentamiento de Lyubashiv, distrito de Podilskyi, región de Odesa, Ucrania",,,
48h,47.60126,30.44555,335.14,15 de agosto,"Comunidad de asentamiento de Lyubashiv, distrito de Podilskyi, región de Odesa, Ucrania",,,
48h,47.44775,29.86451,330.87,15 de agosto,"C-162501, Onilovo, Zakharovskaya Settlement Community, Razdilnyansky District, Región de ODESA, 66722, Ucrania",,,
48h,47.76249,30.12347,352.7,15 de agosto,"Petrivka, Lyubashiv Settlement Community, distrito de Podilskyi, región de Odesa, 66544, Ucrania",,,
48h,47.8369,30.2386,344.77,15 de agosto,"Lyubashivka, Lyubashiv Settlement Community, distrito de Podilskyi, región de Odesa, 66500, Ucrania",,,
48h,47.62104,29.38062,330.9,15 de agosto,"O-161525, Merry Kut, Oknian Settlement Community, distrito de Podilskyi, región de Odesa, 67911, Ucrania",,,
48h,47.86127,30.14469,333.65,15 de agosto,"O-162132, Lyubashiv Settlement Community, Podilskyi District, Región de ODESA, 66521, Ucrania",,,
48h,48.10556,30.22495,330.47,15 de agosto,"SlyUsarevo, Community de Savran City, distrito de Podilskyi, región de ODESA, 66222, Ucrania",,,
48h,48.22643,30.30472,343.56,15 de agosto,"Shevchenko, Comunidad de Annunciation City, Distrito de Golovanivsky, región de Kirovohrad, 26440, Ucrania",,,
48h,48.22724,30.30217,342.28,15 de agosto,"Shevchenko, Comunidad de Annunciation City, Distrito de Golovanivsky, región de Kirovohrad, 26440, Ucrania",,,
48h,48.4546,29.37587,335.18,15 de agosto,"Comunidad de la ciudad de Bershad, distrito de Gaysinsky, región de Vinnytsia, Ucrania",,,
48h,48.123,27.7968,334.32,15 de agosto,"Bogdan Petriceicu Hasdeu Street, Drochia, Distrito de Drochia, Moldavia",,,
48h,48.59471,28.92462,367,15 de agosto,"Kirnasivka, Tulchyn City Community, Distrito de Tulchyn, región de Vinnytsia, 23652, Ucrania",,,
48h,48.59324,28.91973,342.39,15 de agosto,"Kirnasivka, Tulchyn City Community, Distrito de Tulchyn, región de Vinnytsia, 23652, Ucrania",,,
48h,48.59978,28.92138,335.61,15 de agosto,"Hannopil, Comunidad de la Ciudad de Tulchyn, distrito de Tulchyn, región de Vinnytsia, 23655, Ucrania",,,
48h,50.09679,34.27782,342.74,15 de agosto,"O-1706076, Deykalivka, Zinkiv City Community, Distrito de Poltava, región de Poltava, 38132, Ucrania",,,
48h,49.5271,28.91466,347.51,15 de agosto,"Samgorodotsk Village Community, Distrito de Khmelnytskyi, región de Vinnytsia, 22155, Ucrania",,,
48h,49.89121,30.11523,333.38,15 de agosto,"Comunidad rural de Kovalivska, distrito de Belotserkovsky, región de Kiev, Ucrania",,,
48h,54.0906,34.92842,333.75,15 de agosto,"Asentamiento rural de la aldea de Kotor, distrito de Duminichi, región de Kaluga, distrito federal central, Rusia",,,
48h,56.09592,24.2854,327.24,15 de agosto,Vileišių g.,,,
48h,58.47172,31.24959,328.95,15 de agosto,"20B, 49K-1127P1, Rashchep, Rakkomsky Rural Settlement, Distrito de Novgorod, Región de Novgorod, Distrito Federal del Noroeste, 173009, Rusia",,,
48h,58.4735,31.25008,334.27,15 de agosto,"6A, 49K-1127P1, Rashchep, Rakkomsky Rural Settlement, Distrito de Novgorod, Región de Novgorod, Distrito Federal del Noroeste, 173009, Rusia",,,
48h,59.52969,34.14389,329.35,15 de agosto,"Leningradskoye Shosse, Pikalevo, asentamiento de la ciudad de Pikalevsky, distrito de Bokoitogorsky, región de Leningrado, distrito federal del noroeste, 187602, Rusia",,,
48h,58.42728,24.65474,336.95,15 de agosto,"8, Urge Road, Anti, Urge Village, Sindi, Tori Parish, condado de Pärnu, 85010, Estonia",,,
48h,35.18702,33.43895,346.01,15 de agosto,"Λευκωσία - Nicosia, Municipio turco de Nicosia, Nicosia, Northern Chipre, 99040, κύπρος - Chipre",,,
48h,37.24797,31.65389,347.49,15 de agosto,"Kuyucak, Akseki, Antalya, región mediterránea, Türkiye",,,
48h,37.43025,29.57257,345.93,15 de agosto,"Bademli, Acıpayam, Denizli, región del Egeo, Türkiye",,,
48h,37.42983,29.56807,343.5,15 de agosto,"Bademli, Acıpayam, Denizli, región del Egeo, Türkiye",,,
48h,37.92437,23.02515,341.49,15 de agosto,"Comunidad de Isthmia, Unidad Municipal de Loutraki - Perachora, Municipio de Loutraki - Perachora - Agioi Theodoroi, Unidad Regional de Corinto, Región Peloponnese, Administración descentralizada de Peloponeses, Greece e Ioniano, 200 10, Grece",,,
48h,38.92851,32.46103,353.71,15 de agosto,"42-14, Zaferiye, Cihanbeyli, Konya, región central de Anatolia, 42855, Turquía",,,
48h,38.92804,32.45379,351.73,15 de agosto,"Tüfekçipınarı, Cihanbeyli, Konya, región central de Anatolia, Türkiye",,,
48h,39.0364,31.91073,345.86,15 de agosto,"Vecindario Gökpınar, çeltik, Konya, región central de Anatolia, Türkiye",,,
48h,39.03441,31.90976,345.42,15 de agosto,"Vecindario Gökpınar, çeltik, Konya, región central de Anatolia, Türkiye",,,
48h,38.68247,27.54052,339.59,15 de agosto,"Karaağaçlı, şehzadeler, Manisa, región del Egeo, Türkiye",,,
48h,39.33702,34.75968,367,15 de agosto,"Intercesión - Topaklı Road, Sarıkent, Intercesión, Región Central de Anatolia, Türkiye",,,
48h,39.33724,34.7648,337.38,15 de agosto,"Intercesión - Topaklı Road, Sarıkent, Intercesión, Región Central de Anatolia, Türkiye",,,
48h,39.32613,34.15673,367,15 de agosto,"Kırşehir-Yozgat Road, nuevo, Seyrek, Centro Kırşehir, Kırşehir, región central de Anatolia, 40002, Turquía",,,
48h,39.32567,32.29554,355.13,15 de agosto,"Kavak, Haymana, Ankara, región central de Anatolia, Türkiye",,,
48h,37.10762,14.42658,340.7,15 de agosto,"Niscemi Mosaic Cork, SP31, Niscemi, Caltanissetta, Sicilia, 93015, Italia",,,
48h,37.10638,14.4211,345.58,15 de agosto,"Mosaic Cork, SP31, Niscemi, Caltanissetta, Sicilia, 93015, Italia",,,
48h,37.21909,14.26275,341.79,15 de agosto,"Contrada Gibliscemi, Mazzarino, Caltanissetta, Sicilia, 93013, Italia",,,
48h,37.21711,14.26063,344.36,15 de agosto,"Contrada Gibliscemi, Mazzarino, Caltanissetta, Sicilia, 93013, Italia",,,
48h,37.28438,14.49224,330.29,15 de agosto,"SP195, Caltagirone, Catania, Sicilia, 95041, Italia",,,
48h,37.28858,14.49034,334.58,15 de agosto,"SP195, Caltagirone, Catania, Sicilia, 95041, Italia",,,
48h,37.33076,14.59481,336.04,15 de agosto,"Mineo, Catania, Sicilia, 95044, Italia",,,
48h,39.8863,32.91276,344.15,15 de agosto,"Doğukent Street, Akşemsettin Mahallesi, Upper Imrohor Mahallesi, Mamak, Ankara, Región Central de Anatolia, 06270, Turquía",,,
48h,39.92466,32.94512,339.88,15 de agosto,"Barrio árabe, Mamak, Ankara, región central de Anatolia, 06270, Türkiye",,,
48h,37.42886,14.78859,345.79,15 de agosto,"State Road of Aidone, Ramacca, Catania, Sicilia, 95040, Italia",,,
48h,37.42775,14.78356,346.4,15 de agosto,"State Road of Aidone, Ramacca, Catania, Sicilia, 95040, Italia",,,
48h,37.42664,14.77851,342.36,15 de agosto,"State Road of Aidone, Ramacca, Catania, Sicilia, 95040, Italia",,,
48h,37.25002,13.95014,354.98,15 de agosto,"Campobello di licata, Agrigento, Sicilia, 92023, Italia",,,
48h,37.24624,13.94934,338.68,15 de agosto,"Campobello di licata, Agrigento, Sicilia, 92023, Italia",,,
48h,37.25068,13.94786,348.85,15 de agosto,"SPC 55, Campobello di licata, Agrigento, Sicilia, 92023, Italia",,,
48h,37.28897,14.09118,335.44,15 de agosto,"SP174, Riesi, Caltanissetta, Sicilia, 93016, Italia",,,
48h,37.42752,14.6332,339.26,15 de agosto,"Ramacca, Catania, Sicilia, 95040, Italia",,,
48h,40.01164,33.17666,367,15 de agosto,"Ankara, región central de Anatolia, 06850, Türkiye",,,
48h,37.67716,15.1121,336.9,15 de agosto,"Via Monaci, Pisano, Zafferana etnea, Catania, Sicilia, 95019, Italia",,,
48h,39.98219,30.80624,347.13,15 de agosto,"Tepebaşı, Eskişehir, región central de Anatolia, Türkiye",,,
48h,39.98642,30.80052,342.9,15 de agosto,"Tepebaşı, Eskişehir, región central de Anatolia, Türkiye",,,
48h,40.2683,32.96518,347.37,15 de agosto,"Upper Obruk, çubuk, Ankara, región central de Anatolia, 06760, Türkiye",,,
48h,40.26391,32.96674,331.93,15 de agosto,"Upper Obruk, çubuk, Ankara, región central de Anatolia, 06760, Türkiye",,,
48h,35.34933,5.7625,330.83,15 de agosto,"RN 28, The Société des Ciments de Ain-Touta Scimat, Legridet, Tilatou ⵜⵉⵍⴰⵜⵓ omin.",,,
48h,38.04286,15.67749,335.16,15 de agosto,"Slaughter, Upper Trapezi, Pellaro, Reggio di Calabria, Reggio Calabria, Calabria, 89134, Italia",,,
48h,40.25636,30.97124,338.76,15 de agosto,"Güneyçalıca Road, Güneyçalıca, Göynük, Bolu, Región del Mar Negro, Turquía",,,
48h,40.2559,30.9647,341.96,15 de agosto,"Güneyçalıca, Göynük, Bolu, Región del Mar Negro, Türkiye",,,
48h,40.53813,33.37672,338.64,15 de agosto,"Kayapınar, şabanözü, çankırı, región central de Anatolia, Türkiye",,,
48h,37.86013,13.15775,341.09,15 de agosto,"SP27BIS, Roccamena, Palermo, Sicilia, 90040, Italia",,,
48h,37.85872,13.15174,349.3,15 de agosto,"SP27BIS, Roccamena, Palermo, Sicilia, 90040, Italia",,,
48h,37.85846,13.1578,338.16,15 de agosto,"SP27BIS, Roccamena, Palermo, Sicilia, 90040, Italia",,,
48h,37.85703,13.15186,347.73,15 de agosto,"SP27BIS, Roccamena, Palermo, Sicilia, 90040, Italia",,,
48h,37.79328,12.7637,333.07,15 de agosto,"Provincial Road 79 de Mokarta, Salemi, Trapani, Sicilia, 91018, Italia",,,
48h,37.85067,12.70843,343.05,15 de agosto,"RECLAMACIÓN DE RECLAMACIÓN 6 Mulinazzo - Dimina - Ranchibilotto - Ranchible, Salemi, Trapani, Sicilia, 91018, Italia",,,
48h,37.85218,12.71341,336.29,15 de agosto,"RECLAMACIÓN DE RECLAMACIÓN 6 Mulinazzo - Dimina - Ranchibilotto - Ranchible, Salemi, Trapani, Sicilia, 91018, Italia",,,
48h,37.85064,12.70712,339.32,15 de agosto,"Strada Agricola Borgo Fazio - Ricalcata, Salemi, Trapani, Sicilia, 91018, Italia",,,
48h,38.87038,16.4432,339.59,15 de agosto,"Maida, Catanzaro, Calabria, 88025, Italia",,,
48h,38.87288,16.43565,336.35,15 de agosto,"Vena di Maida, Maida, Catanzaro, Calabria, 88025, Italia",,,
48h,36.86758,6.98651,331.43,15 de agosto,"Voie Rapide Skikda-Laarbi Ben Mhidi, Allaua Taghane, Hamadi Krouma ⵃⴻⵎⵎⴰⴷⵉ ⴽⵔⵓⵎⴰ ⴽⵔⵓⵎⴰ Hammadi Karma, Daïra Skikda, Skikda, 21039, Algérie",,,
48h,36.86612,6.97966,330.14,15 de agosto,"Voie Rapide Skikda-Laarbi Ben Mhidi, Allaua Taghane, Skikda ⵙⴽⵉⴽⴷⴰ Skikda, Daïra Skikda, Skikda, 21039, Algérie",,,
48h,36.74669,6.25869,346.54,15 de agosto,"La zona industrial de Bellara, Mechta Beni Zebbane, El Milia ⵵⵵⵵⵵ ൢ ⴰ ⴰ",,,
48h,41.53165,33.92596,331.86,15 de agosto,"Tea, Taşköprü, Kastamonu, región del Mar Negro, Türkiye",,,
48h,40.48565,21.77707,336.01,15 de agosto,"Ptolewa Power Plant, Municipio de Eordaia, Unidad Regional de Kozani, Región de Macedonia occidental, Administración descentralizada de Epirus - Macedonia occidental, Grecia",,,
48h,39.50154,16.18231,332.78,15 de agosto,"Sartano, Torano Castello, Cosenza, Calabria, 87043, Italia",,,
48h,39.93859,18.27697,344.07,15 de agosto,"S. Angelo Municipal Road, Specchia, Lecce, Puglia, 73035, Italia",,,
48h,39.94204,18.27588,340.51,15 de agosto,"Strada Vicinale Cervi, Cardigliano, Specchia, Lecce, Puglia, 73035, Italia",,,
48h,40.00473,18.29878,334.4,15 de agosto,"Surano Provincial Road - Torrepaduli - Ruffano, Ruffano, Lecce, Puglia, 73049, Italia",,,
48h,40.00726,18.29267,332.37,15 de agosto,"Nociglia Provincial Road - Fontana Alla Surano - Torrepaduli - Ruffano, Supersano, Lecce, Puglia, 73049, Italia",,,
48h,39.7302,16.09914,332.66,15 de agosto,"Provincial Road 263 EX SS105 de Castrovillari, Acquaformosa, Cosenza, Calabria, 87010, Italia",,,
48h,40.33992,17.84746,335.14,15 de agosto,"Nardò, Lecce, Puglia, Italia",,,
48h,40.35617,17.87516,337.27,15 de agosto,"Provincial Road SP111 Veglie - Cerfeta - Monterga Alla San Pancrazio - Boncore, Monterug, Veglie, Lecce, Puglia, 73010, Italia",,,
48h,40.43373,17.99534,338.29,15 de agosto,"Campi Salentina, Lecce, Puglia, 73018, Italia",,,
48h,40.42221,17.8356,333.77,15 de agosto,"Via Settembrini, San Pancrazio Salentino, Brindisi, Puglia, 72026, Italia",,,
48h,40.49763,18.08298,338.42,15 de agosto,"Lendinuso, Torchiarolo, Brindisi, Puglia, Italia",,,
48h,40.49171,18.03105,340.31,15 de agosto,"Torchiarolo, Brindisi, Puglia, 72027, Italia",,,
48h,40.46944,17.83144,338.25,15 de agosto,"SP74, San Pancrazio Salentino, Brindisi, Puglia, 72026, Italia",,,
48h,41.12912,21.47858,343.69,15 de agosto,"Trampa, municipio de Mogila, Pelagonia SR, Macedonia del Norte",,,
48h,40.47003,17.42745,337.63,15 de agosto,"Carosino, Taranto, Puglia, 74021, Italia",,,
48h,40.47764,17.44771,339.06,15 de agosto,"SP ex SS603, Taranto, Puglia, 74021, Italia",,,
48h,40.89291,19.59968,338.51,15 de agosto,"Gradishta, Municipio de Divjaka, Distrito de Fier, sur de Albania, 9014, Albania",,,
48h,40.57503,17.51624,335.04,15 de agosto,"Francavilla Fontana, Brindisi, Puglia, 72029, Italia",,,
48h,40.57956,17.52041,334.57,15 de agosto,"Francavilla Fontana, Brindisi, Puglia, 72021, Italia",,,
48h,41.4931,22.59262,336.72,15 de agosto,"Ángeles, Municipio de Vasilvo, Sudeste de SR, Macedonia del Norte",,,
48h,41.36695,21.3613,354.19,15 de agosto,"VRanche, Municipio de Dolneni, Pelagonija SR, Macedonia del Norte",,,
48h,41.53499,21.41279,331.04,15 de agosto,"Crnilishte, Municipio de Dolneni, Pelagonija Sr, 7516, Macedonia del Norte",,,
48h,40.74102,16.54853,338.18,15 de agosto,"Matera, Basilicata, Italia",,,
48h,40.74465,16.54731,347.32,15 de agosto,"Matera, Basilicata, Italia",,,
48h,40.80519,16.75685,331.75,15 de agosto,"Via Simone Peppino, Santeramo en Colle, Bari, Puglia, 70029, Italia",,,
48h,40.79228,15.91631,333.47,15 de agosto,"Acerenza, Potenza, Basilicata, 85011, Italia",,,
48h,40.79606,15.9153,337.03,15 de agosto,"Acerenza, Potenza, Basilicata, 85011, Italia",,,
48h,40.79489,15.91406,340.41,15 de agosto,"Acerenza, Potenza, Basilicata, 85011, Italia",,,
48h,41.91161,22.26423,349.26,15 de agosto,"Sokolarci, Municipio de Cheshinovo-Obleshevo, East SR, Macedonia del Norte",,,
48h,41.91095,22.25957,335.47,15 de agosto,"Sokolarci, Municipio de Cheshinovo-Obleshevo, East SR, Macedonia del Norte",,,
48h,41.91556,22.26798,336.71,15 de agosto,"Sokolarci, Municipio de Cheshinovo-Obleshevo, East SR, Macedonia del Norte",,,
48h,41.91491,22.26334,346.14,15 de agosto,"Sokolarci, Municipio de Cheshinovo-Obleshevo, East SR, Macedonia del Norte",,,
48h,41.91754,22.2578,341.67,15 de agosto,"Vrbica, Municipio de Cheshinovo-Obleshevo, East SR, Macedonia del Norte",,,
48h,40.91493,16.23208,344.47,15 de agosto,"Poggiorsini, Bari, Puglia, Italia",,,
48h,40.99038,15.87897,335.64,15 de agosto,"Ofantina, Venosa, Potenza, Basilicata, 85029, Italia",,,
48h,40.99041,15.83958,333.22,15 de agosto,"Ofantina, Venosa, Potenza, Basilicata, 85029, Italia",,,
48h,41.00643,15.87965,330.61,15 de agosto,"Provincial Road 135 Boreana, Boreano, Venosa, Potenza, Basilicata, Italia",,,
48h,42.06564,21.72748,347.48,15 de agosto,"Pcinja, Municipio de Kumanovo, Noreste de SR, Macedonia del Norte",,,
48h,42.06891,21.7266,340.79,15 de agosto,"Pcinja, Municipio de Kumanovo, Noreste de SR, Macedonia del Norte",,,
48h,42.07287,21.73034,342.83,15 de agosto,"Pcinja, Municipio de Kumanovo, Noreste de Sr, 1300, Macedonia del Norte",,,
48h,42.07219,21.72573,334.6,15 de agosto,"Pcinja, Municipio de Kumanovo, Noreste de SR, Macedonia del Norte",,,
48h,42.07615,21.72947,338.73,15 de agosto,"Pcinja, Municipio de Kumanovo, Noreste de Sr, 1300, Macedonia del Norte",,,
48h,42.07547,21.72485,330.89,15 de agosto,"Romanovce, Municipio de Kumanovo, Noreste de SR, Macedonia del Norte",,,
48h,39.40018,8.95877,340.11,15 de agosto,"BID BIDDAREGA, BELFESORRIS / VILLASOR CAGLIAR, SARDINIA, 09034, Francia",,,
48h,41.04485,15.7394,334.61,15 de agosto,"State Road 655 Bradanica, Melfi, Potenza, Basilicata, 85024, Italia",,,
48h,42.17476,22.15163,339.91,15 de agosto,"Ginovci, Municipio de Rankovce, Noreste de SR, Macedonia del Norte",,,
48h,39.51835,8.97721,354.29,15 de agosto,"Serrenti, Medio Campidano, Sardigna/Sardinia, 09027, Italia",,,
48h,42.25297,21.68163,343.86,15 de agosto,"Jakanovac, Municipio de Presevo, Distrito Administrativo de Pcinjski, Central Serbia, 17523, Serbia",,,
48h,41.35027,15.48751,345.03,15 de agosto,"Via San Nicola, Foggia, Puglia, 71025, Italia",,,
48h,42.29869,20.67324,331.55,15 de agosto,"Basarine, Pirana, Municipio de Prizren / Opština Prizren / Prizren Belediyesi, 21080, Kosovo / Kosovo",,,
48h,41.36265,15.40994,349.31,15 de agosto,"Troy, Foggia, Puglia, Italia",,,
48h,41.36381,15.40713,340.96,15 de agosto,"Troy, Foggia, Puglia, Italia",,,
48h,41.35524,15.26929,336.07,15 de agosto,"Troy, Foggia, Puglia, Italia",,,
48h,41.44786,15.46223,338.4,15 de agosto,"SP117, Lucera, Foggia, Puglia, Italia",,,
48h,41.45806,15.20971,336.63,15 de agosto,"Tratturo delle Anguille, Biccari, Foggia, Puglia, Italia",,,
48h,42.51664,21.04795,332.87,15 de agosto,"Rrahim Hoti, Great Ribar, Municipio de Lipjan / Opština Lippljan, 14060, Kosovo / Kosovo",,,
48h,41.25338,14.11867,339.12,15 de agosto,"Teano, Caserta, 81042, Italia",,,
48h,41.25738,14.11719,343.03,15 de agosto,"State Road 6 Casilina, Teano, Caserta, 81059, Italia",,,
48h,42.56938,21.08153,335.53,15 de agosto,"South Bogdana, Lepina - Lepi, Opština Gračanica / Municipio de Gracanica / E Gracanicikii Municipio, 35000, Kosovo / Kosovo",,,
48h,41.57221,15.42896,342.08,15 de agosto,"SP Foggia - Torremaggiore, San Severo, Foggia, Puglia, Italia",,,
48h,41.57408,15.42691,339.54,15 de agosto,"SP Foggia - Torremaggiore, San Severo, Foggia, Puglia, Italia",,,
48h,39.96674,8.64297,354.31,15 de agosto,SERRAS SOLTA,,,
48h,39.96546,8.63836,348.19,15 de agosto,"SiaMajori/Siamaggiore, Aristanis/Oristano, Sardigna/Sardinia, 09070, Italia",,,
48h,39.96418,8.63378,336.67,15 de agosto,"SiaMajori/Siamaggiore, Aristanis/Oristano, Sardigna/Sardinia, 09070, Italia",,,
48h,39.96946,8.63124,340.72,15 de agosto,"SiaMajori/Siamaggiore, Aristanis/Oristano, Sardigna/Sardinia, 09070, Italia",,,
48h,41.83903,15.40056,336.1,15 de agosto,"Imperial Poggio, Foggia, Puglia, Italia",,,
48h,41.77373,15.04756,338.05,15 de agosto,"Road Inter -Municipal SP78, Rotello, Campobasso, Molise, 86047, Italia",,,
48h,41.77995,15.03832,343.05,15 de agosto,"Rotello, Campobasso, Molise, 86047, Italia",,,
48h,41.59307,13.6575,352.78,15 de agosto,"Lenzetta, Santopadre, Frosinone, Lazio, Italia",,,
48h,43.13921,21.7622,329.46,15 de agosto,"Gornje Crnatovo, Municipio de žitorađa, Toplički Prođeni County, Central Serbia, Serbia",,,
48h,43.93869,24.76074,337.49,15 de agosto,"Uda-Clocociov, Teleorman, Rumania",,,
48h,43.94588,24.75918,341.06,15 de agosto,"Slobozia Mândra, Teleorman, 147355, Rumania",,,
48h,43.93974,24.76331,337.71,15 de agosto,"Slobozia Mândra, Teleorman, 147355, Rumania",,,
48h,43.94694,24.76174,335.2,15 de agosto,"Slobozia Mândra, Teleorman, 147355, Rumania",,,
48h,43.94629,24.75598,336.35,15 de agosto,"Slobozia Mândra, Teleorman, 147355, Rumania",,,
48h,44.4303,25.33104,336.04,15 de agosto,"Cătunu, Poeni, Teleorman, 147273, Rumania",,,
48h,42.27472,11.96299,333.66,15 de agosto,"La Selciatella, Vetralla, Viterbo, Lazio, Italia",,,
48h,45.37193,30.933,336.97,15 de agosto,Plataforma,,,
48h,45.6303,29.52585,342.51,15 de agosto,"Distrito Nonyshaysky Starostinsky, Comunidad de la Ciudad de Tatarbunar, Distrito de Belgorod-Dnestrovsky, región de Odesa, 68122, Ucrania",,,
48h,46.11354,33.44751,344.66,15 de agosto,"Kalanchatska City Community, distrito de Skadovsky, región de Kherson, 75840, Ucrania",,,
48h,46.11337,33.44218,341.4,15 de agosto,"Kalanchatska City Community, distrito de Skadovsky, región de Kherson, 75840, Ucrania",,,
48h,46.15408,33.02242,344.75,15 de agosto,"Ozerne, Skadovsk City Community, Distrito de Skadovsky, región de Kherson, 75704, Ucrania",,,
48h,46.15445,33.02073,345.95,15 de agosto,"Ozerne, Skadovsk City Community, Distrito de Skadovsky, región de Kherson, 75704, Ucrania",,,
48h,44.88801,19.5224,340.55,15 de agosto,"Glušci, Municipio de Bogatić, Macvanski Upravni Okrug, Centralna Srbija, 15356, Serbia",,,
48h,44.89127,19.52139,333.23,15 de agosto,"Glušci, Municipio de Bogatić, Macvanski Upravni Okrug, Centralna Srbija, 15356, Serbia",,,
48h,46.17417,33.11681,336.28,15 de agosto,"Tarasivka, Skadovsk City Community, Distrito de Skadovsky, región de Kherson, 75704, Ucrania",,,
48h,46.20086,32.38213,333.96,15 de agosto,"O220804, Slipushinskoye, Dolmatovsky Village Community, Distrito de Skadovsky, región de Kherson, 75660, Ucrania",,,
48h,46.1088,30.22004,344.37,15 de agosto,"Comunidad de la aldea de Shabivska, distrito de Belgorod-Dnestrovsky, región de Odesa, Ucrania",,,
48h,46.10835,30.21267,342.09,15 de agosto,"Circásicos, Comunidad Rural de Shabiv, Distrito de Belgorod-Dnestrovsky, región de Odesa, 67790, Ucrania",,,
48h,44.86127,18.72087,349.83,15 de agosto,"Lipovac, Ulnovovići, Ulnovovići, Brčko Distrikt, 76120, Bosnia y Herzegovina / Bosnia y Herzegovina",,,
48h,45.00573,19.55344,331.46,15 de agosto,"Plan Sremska Mitrovica, Sremski Upravni Okrug, Vojvodina, 22221, Serbia",,,
48h,46.40104,34.16083,367,15 de agosto,"Novotroitsk Settlement Community, Genichesky District, región de Kherson, Ucrania",,,
48h,46.40107,34.16012,367,15 de agosto,"Novotroitsk Settlement Community, Genichesky District, región de Kherson, Ucrania",,,
48h,46.55504,33.46234,348.37,15 de agosto,"Comunidad de asentamiento de Chaplinsk, distrito de Kakhovsky, región de Kherson, Ucrania",,,
48h,46.54359,32.9614,340.42,15 de agosto,"Oleshkiv City Community, Distrito de Kherson, región de Kherson, Ucrania",,,
48h,46.57569,32.79662,349.12,15 de agosto,"Oleshkiv City Community, Distrito de Kherson, región de Kherson, Ucrania",,,
48h,46.57549,32.79157,347.08,15 de agosto,"Oleshkiv City Community, Distrito de Kherson, región de Kherson, Ucrania",,,
48h,46.57698,32.79722,342.61,15 de agosto,"Oleshkiv City Community, Distrito de Kherson, región de Kherson, Ucrania",,,
48h,46.57681,32.79218,354.05,15 de agosto,"Oleshkiv City Community, Distrito de Kherson, región de Kherson, Ucrania",,,
48h,45.21312,18.73072,332.74,15 de agosto,"Andrijaševci, Municipio de Andrijaševci, condado de Vukovar-Srijem, 32271, Croacia",,,
48h,46.59894,32.80082,331.48,15 de agosto,"Oleshkiv City Community, Distrito de Kherson, región de Kherson, Ucrania",,,
48h,46.61572,32.96796,367,15 de agosto,"Oleshkiv City Community, Distrito de Kherson, región de Kherson, Ucrania",,,
48h,46.61554,32.9628,340.4,15 de agosto,"Oleshkiv City Community, Distrito de Kherson, región de Kherson, Ucrania",,,
48h,46.59218,32.3337,343.28,15 de agosto,"Cerámica, Belozersk Settlement Community, Distrito de Kherson, región de Kherson, 75005, Ucrania",,,
48h,46.65416,33.85331,335.64,15 de agosto,"Comunidad de la aldea de Zelenopyska, distrito de Kakhovsky, región de Kherson, Ucrania",,,
48h,46.65401,33.84763,349.99,15 de agosto,"Comunidad de la aldea de Zelenopyska, distrito de Kakhovsky, región de Kherson, Ucrania",,,
