tipo,latitude,longitude,bright,date,admin2,admin3,country_code,country_es
48h,54.5093,-6.17775,342.47,16 de agosto,"Maghaberry Road, Maghaberry, Condado de Antrim, Irlanda del Norte / Irlanda del Norte, BT67 0JE, Reino Unido",,,
48h,54.51252,-6.17932,345.46,16 de agosto,"Wellington Park Crescent, Maghaberry, Condado de Antrim, Irlanda del Norte / Irlanda del Norte, BT67 0JE, Reino Unido",,,
48h,54.51672,-6.17507,351.72,16 de agosto,"Hallstown Road, Lisburn, Condado de Antrim, Irlanda del Norte / Irlanda del Norte, BT67 0Je, Reino Unido",,,
48h,54.51575,-6.1809,333.38,16 de agosto,"Prisión de Maghaberry, Old Road, Maghaberry, Condado de Antrim, Irlanda del Norte / Irlanda del Norte, BT67 0Je, Reino Unido",,,
48h,54.60933,-6.15918,335.66,16 de agosto,"Knockcairn Road, Lisburn, Condado de Antrim, Irlanda del Norte / Irlanda del Norte, BT29 4HX, Reino Unido",,,
48h,54.60836,-6.16503,335.43,16 de agosto,"Knockcairn Road, Lisburn, Condado de Antrim, Irlanda del Norte / Irlanda del Norte, BT29 4HR, Reino Unido",,,
48h,54.6203,-6.17723,344.39,16 de agosto,"A26, Crumlin, Condado de Antrim, Irlanda del Norte / Irlanda del Norte, BT29 4SR, Reino Unido",,,
48h,54.74028,-6.25039,349.39,16 de agosto,"M22, Condado de Antrim, Irlanda del Norte / Irlanda del Norte, BT41 4LZ, Reino Unido",,,
48h,58.27685,6.88912,333.22,16 de agosto,"Øyesletta, Ledål, Øye, Kvinesdal, Agder, 4484, Noruega",,,
48h,58.27686,6.88781,329.97,16 de agosto,"63, Øyesletta, Ledål, Øye, Kvinesdal, Agder, 4484, Noruega",,,
48h,37.11346,-6.24023,338.24,16 de agosto,"La Sarteneja, Aznalcázar, Sevilla, Andalucía, España",,,
48h,38.65509,-8.94322,349.11,16 de agosto,"CM 1024, matorral, grande Sarilhos, Montijo, Setúbal, 2870-512, Portugal",,,
48h,39.7265,-8.68305,367,16 de agosto,"Vale da Rosa, Caranguejeira, Leiria, 2420-115, Portugal",,,
48h,39.72635,-8.68958,350.09,16 de agosto,"Rua da cerámica, pareja roja, Caranguejeira, Leiria, 2420-083, Portugal",,,
48h,59.0661,28.13424,303.64,16 de agosto,"Planta de cemento, planta de cemento, un asentamiento rural que habla, distrito de Slaintsevsky, región de Leningrado, distrito federal del noroeste, 188561, Rusia",,,
48h,59.06216,28.13284,300.57,16 de agosto,"Planta de cemento, planta de cemento, un asentamiento rural que habla, distrito de Slaintsevsky, región de Leningrado, distrito federal del noroeste, 188561, Rusia",,,
48h,34.72463,33.31393,318,16 de agosto,"Silo de carbón, F405, Mari, Larnaca, Chipre, 7739, Chipre - Kıbrıs",,,
48h,56.46986,31.39249,332.67,16 de agosto,"Llamadas, asentamiento rural de Skvortsovskoye, distrito de Toropetsky, región de tver, distrito federal central, 172890, Rusia",,,
48h,55.20323,34.40358,298.23,16 de agosto,"Acuerdo rural de Stepanikovskoye, distrito de Vyazemsky, región de Smolensk, distrito federal central, Rusia",,,
48h,53.44483,34.41398,328.32,16 de agosto,"CJSC ""Maltsovsky Portland Cement"", Ostrovsky Street, Fokino, City District Fokino, Región de Bryansk, Distrito Federal Central, 242610, Rusia",,,
48h,53.26135,24.44822,304.08,16 de agosto,"OJSC ""Krasnoselskbudmaterialy"", H6303, Consejo de la aldea de Krasnoselsky, distrito de Vaukavysk, región de Grodno, 231911, Bielorrusia",,,
48h,52.80769,32.2259,309.5,16 de agosto,"Planta Klintsovsky Silikatnaya, Cheerna, asentamiento rural de Smolevichi, Distrito de Klintsovsky, región de Bryansk, Distrito Federal Central, 243101, Rusia",,,
48h,52.84729,29.98894,348.65,16 de agosto,"Planta Metalúrgica Bielorrusia, H433, Consejo de la Villa de Salón, Distrito de Zhlobin, Región de Gomel, 247220, Bielorrusia",,,
48h,51.89379,29.33457,325.87,16 de agosto,"OJSC ""Mozyr Refinery de petróleo"", Consejo de la aldea de Mikhalkovsky, distrito de Mozyr, región de Gomel, Bielorrusia",,,
48h,51.89336,29.3429,308.41,16 de agosto,"Consejo de la aldea de Mikhalkovsky, distrito de Mozyr, región de Gomel, Bielorrusia",,,
48h,51.88901,29.33382,301.95,16 de agosto,"Consejo de la aldea de Mikhalkovsky, distrito de Mozyr, región de Gomel, Bielorrusia",,,
48h,51.89386,29.33565,336.37,16 de agosto,"OJSC ""Mozyr Refinery de petróleo"", Consejo de la aldea de Mikhalkovsky, distrito de Mozyr, región de Gomel, Bielorrusia",,,
48h,51.8891,29.33492,302.63,16 de agosto,"P37, Mitka, Consejo de la aldea de Mikhalkovsky, distrito de Mozyr, región de Gomel, Bielorrusia",,,
48h,51.26462,33.17739,297.38,16 de agosto,"O-190510, Factory, Popivska Village Community, Konotop District, Sumy Region, 41631, Ucrania",,,
48h,50.9682,30.61558,301.29,16 de agosto,"Cherninskaya Road, Pyrnovsk Rural Community, Vyshgorod District, región de Kiev, Ucrania",,,
48h,50.97023,30.61761,298.47,16 de agosto,"Cherninskaya Road, Pyrnovsk Rural Community, Vyshgorod District, región de Kiev, Ucrania",,,
48h,50.5458,26.25959,305.93,16 de agosto,"T-18-01, Cement Plant, Zdolbuniv, Zdolbuniv City Community, Rivne District, Rivne Region, 35350, Ucrania",,,
48h,50.54422,26.25747,307.82,16 de agosto,"T-18-01, Cement Plant, Zdolbuniv, Zdolbuniv City Community, Rivne District, Rivne Region, 35350, Ucrania",,,
48h,48.53482,34.64477,311.59,16 de agosto,"Comunidad de asentamiento de Petrykivska, Distrito de Dniprovsky, región de Dnipropetrovsk, Ucrania",,,
48h,48.53404,34.61809,303.76,16 de agosto,"SoBorna Street, Distrito de Fábrica, Kamianske, Comunidad de la Ciudad de Kamiansk, Distrito de Kamyansky, región de Dnipropetrovsk, 51931, Ucrania",,,
48h,48.53039,34.6172,303.4,16 de agosto,"1st Medical Publite, SoBorna Street, District de fábrica, Kamianske, Comunidad de la Ciudad de Kamyansk, Distrito de Kamyansky, región de Dnipropetrovsk, 51931, Ucrania",,,
48h,48.52681,34.64938,314.19,16 de agosto,"Wide Street, Southern District, Kamianske, Kamiansk City Community, Distrito de Kamyansky, región de Dnipropetrovsk, 51910, Ucrania",,,
48h,48.52167,34.62823,321.42,16 de agosto,"Slovyanskaya Street, Distrito de Fábrica, Kamianske, Kamyansk City Community, Distrito de Kamyansky, región de Dnipropetrovsk, 51931, Ucrania",,,
48h,48.47222,34.96855,305.69,16 de agosto,"Dniprokox, Ivan Mazepa Avenue, Distrito de Novokodatsky, Dnipro, Dniprovsk City Community, Dniprovsky District, Dnipropetrovsk Region, 49000, Ucrania",,,
48h,48.47281,34.62978,316.3,16 de agosto,"R-80, Distrito Sur, Kamianske, Comunidad de la Ciudad de Kamiansk, Distrito de Kamyansky, región de Dnipropetrovsk, 52050, Ucrania",,,
48h,48.97517,24.71125,297.08,16 de agosto,"Yamnytsia, Comunidad de la aldea de Yamnytska, Distrito de Ivano-Frankivsk, Región de Ivano-Frankivsk, 77422, Ucrania",,,
48h,48.74732,26.60013,303.1,16 de agosto,"Khmelnitsky Highway, planta de cemento, Humenets, Comunidad de la aldea de Gumenetsky, Distrito de Kamianets-Podilskyi, región de Khmelnitsky, 32325, Ucrania",,,
48h,48.74715,26.60499,305.93,16 de agosto,"Cemento Podilsky, 1A, Carretera Khmelnitsky, planta de cemento, Humenets, Humenets Rural Community, Kamianets-Podilskyi District, Región de Khmelnitsky, 32325, Ucrania",,,
48h,48.748,26.60417,317.95,16 de agosto,"Cemento Podilsky, 1A, Carretera Khmelnitsky, planta de cemento, Humenets, Humenets Rural Community, Kamianets-Podilskyi District, Región de Khmelnitsky, 32325, Ucrania",,,
48h,48.44152,29.34916,308.55,16 de agosto,"Demidovka, Comunidad de asentamiento de Trostyanets, Distrito de Gaisinsky, región de Vinnytsia, 24343, Ucrania",,,
48h,47.87931,33.40509,309.39,16 de agosto,"Calle Prokurenik, antigua ciudad social, distrito metalúrgico, Kryvyi Rih, Kryvyi Rih City Community, Distrito de Kryvyi Rih, región de Dnipropetrovsk, 50006, Ucrania",,,
48h,47.8741,33.41808,333.01,16 de agosto,"Calle Prokurenik, antigua ciudad social, distrito metalúrgico, Kryvyi Rih, Kryvyi Rih City Community, Distrito de Kryvyi Rih, región de Dnipropetrovsk, 50006, Ucrania",,,
48h,47.87481,33.41116,304.76,16 de agosto,"Calle Prokurenik, antigua ciudad social, distrito metalúrgico, Kryvyi Rih, Kryvyi Rih City Community, Distrito de Kryvyi Rih, región de Dnipropetrovsk, 50006, Ucrania",,,
48h,47.8689,33.43107,305.52,16 de agosto,"Conjunto Stock Street, Distrito Metalúrgico, Kryvyi Rih, Kryvyi Rih City Community, Distrito Kryvyi Rih, región de Dnipropetrovsk, 50103, Ucrania",,,
48h,47.71796,30.09429,322.56,16 de agosto,"Comunidad de la ciudad de Ananyev, distrito de Podilskyi, región de Odesa, Ucrania",,,
48h,47.71355,30.09345,334.74,16 de agosto,"Comunidad de la ciudad de Ananyev, distrito de Podilskyi, región de Odesa, Ucrania",,,
48h,47.78519,29.01561,304.15,16 de agosto,"Calle industrial, Ayuntamiento de Rybnitsky, Za Rybnitsa / Rybnitsky District / Ribnitzky District, Unitțile administrativ-Theritorialle Din Lifta Nistruului, Nistrieniya / Transnistria / Pridnistrov'ya, MD-0555, Moldova",,,
48h,47.71458,30.09383,341.43,16 de agosto,"Comunidad de la ciudad de Ananyev, distrito de Podilskyi, región de Odesa, Ucrania",,,
48h,47.78733,29.01712,306.55,16 de agosto,"Calle industrial, Ayuntamiento de Rybnitsky, Za Rybnitsa / Rybnitsky District / Ribnitzky District, Unitțile administrativ-Theritorialle Din Lifta Nistruului, Nistrieniya / Transnistria / Pridnistrov'ya, MD-0555, Moldova",,,
48h,47.28111,34.48162,301.68,16 de agosto,"Comunidad de asentamientos de Verkhnorogachytska, distrito de Kakhovsky, región de Kherson, Ucrania",,,
48h,47.2832,34.43127,305.82,16 de agosto,"Comunidad de asentamientos de Verkhnorogachytska, distrito de Kakhovsky, región de Kherson, Ucrania",,,
48h,47.28029,34.42419,312.57,16 de agosto,"Comunidad de asentamientos de Verkhnorogachytska, distrito de Kakhovsky, región de Kherson, Ucrania",,,
48h,47.67452,29.97085,310.03,16 de agosto,"C-160114, Comunidad de la ciudad de Ananyev, distrito de Podilskyi, región de ODESA, 66422, Ucrania",,,
48h,47.59857,30.45345,308.5,16 de agosto,"Comunidad de asentamiento de Lyubashiv, distrito de Podilskyi, región de Odesa, Ucrania",,,
48h,47.59424,30.45261,296.69,16 de agosto,"Comunidad de asentamiento de Lyubashiv, distrito de Podilskyi, región de Odesa, Ucrania",,,
48h,47.1954,34.51723,309.95,16 de agosto,"Comunidad rural de Greater Belozersk, distrito de Vasylivskyi, Región de Zaporizhzhya, Ucrania",,,
48h,47.18343,34.45646,303.8,16 de agosto,"Comunidad de asentamientos de Verkhnorogachytska, distrito de Kakhovsky, región de Kherson, Ucrania",,,
48h,47.17982,34.45556,307.42,16 de agosto,"Comunidad de asentamientos de Verkhnorogachytska, distrito de Kakhovsky, región de Kherson, Ucrania",,,
48h,47.10453,34.39892,303.4,16 de agosto,"Comunidad de asentamientos de Verkhnorogachytska, distrito de Kakhovsky, región de Kherson, Ucrania",,,
48h,47.10091,34.39802,305.16,16 de agosto,"Comunidad de la aldea de Rubanivska, distrito de Kakhovsky, región de Kherson, Ucrania",,,
48h,46.89072,34.41525,306.81,16 de agosto,"Comunidad de Bajo Sygorod Town, Distrito Genichesky, región de Kherson, Ucrania",,,
48h,46.89003,34.42137,305.11,16 de agosto,"Comunidad de Bajo Sygorod Town, Distrito Genichesky, región de Kherson, Ucrania",,,
48h,46.63462,34.34412,305.09,16 de agosto,"Comunidad de asentamientos de Ivanovo, Distrito Genichesky, región de Kherson, Ucrania",,,
48h,46.7534,33.20173,309.85,16 de agosto,"Korsunka, Comunidad de la ciudad de Novokakhovsky, Distrito de Kakhovsky, región de Kherson, 74990, Ucrania",,,
48h,46.59913,34.29801,304.28,16 de agosto,"Comunidad de asentamientos de Ivanovo, Distrito Genichesky, región de Kherson, Ucrania",,,
48h,46.64664,32.97,309.92,16 de agosto,"Oleshkiv City Community, Distrito de Kherson, región de Kherson, Ucrania",,,
48h,46.47049,34.28437,323.27,16 de agosto,"Novotroitsk Settlement Community, Genichesky District, región de Kherson, Ucrania",,,
48h,46.46981,34.29043,313.79,16 de agosto,"C221511, Novotroitsk Settlement Community, Genichesky District, región de Kherson, 75331, Ucrania",,,
48h,46.46689,34.2835,321.28,16 de agosto,"Novotroitsk Settlement Community, Genichesky District, región de Kherson, Ucrania",,,
48h,46.4662,34.28955,310.89,16 de agosto,"C221511, Novotroitsk Settlement Community, Genichesky District, región de Kherson, 75331, Ucrania",,,
48h,46.55397,32.97905,302.99,16 de agosto,"Oleshkiv City Community, Distrito de Kherson, región de Kherson, Ucrania",,,
48h,46.55016,32.97823,316.95,16 de agosto,"Oleshkiv City Community, Distrito de Kherson, región de Kherson, Ucrania",,,
48h,46.28745,33.80448,328.21,16 de agosto,"O221802, Pavlovka, Comunidad Rural de Prysovask, Distrito de Kakhovsky, región de Kherson, 75240, Ucrania",,,
48h,46.28378,33.80361,315.29,16 de agosto,"O221802, Pavlovka, Comunidad Rural de Prysovask, Distrito de Kakhovsky, región de Kherson, 75240, Ucrania",,,
48h,46.27318,33.73043,317.51,16 de agosto,"Grigorivka, comunidad rural privada, distrito de Kakhovsky, región de Kherson, 75240, Ucrania",,,
48h,46.2695,33.72957,308.09,16 de agosto,"Comunidad rural de Privaska, Distrito de Kakhovsky, región de Kherson, Ucrania",,,
48h,46.24664,33.41786,312.95,16 de agosto,"Novooleksandrivka, Kalanchatskaya Settlement Community, Distrito de Skadovsky, región de Kherson, 75821, Ucrania",,,
48h,46.21495,33.13644,307.12,16 de agosto,"Hrushevka, Skadovsk City Community, Distrito de Skadovsky, región de Kherson, 75743, Ucrania",,,
48h,46.10826,33.41211,320.57,16 de agosto,"O221108, Kalanchatsk Settlement Community, Distrito de Skadovsky, región de Kherson, 75840, Ucrania",,,
48h,46.10756,33.41851,306.09,16 de agosto,"Comunidad de Kalanchatska, Distrito de Skadovsky, región de Kherson, Ucrania",,,
48h,46.10455,33.41126,310.4,16 de agosto,"Comunidad de Kalanchatska, Distrito de Skadovsky, región de Kherson, Ucrania",,,
48h,46.10224,33.39759,325.48,16 de agosto,"Comunidad de Kalanchatska, Distrito de Skadovsky, región de Kherson, Ucrania",,,
48h,46.10154,33.40401,312.51,16 de agosto,"Comunidad de Kalanchatska, Distrito de Skadovsky, región de Kherson, Ucrania",,,
48h,46.32358,30.02849,311.01,16 de agosto,"Comunidad de Starokozatsk Village, distrito de Belgorod-Dnestrovsky, región de Odesa, Ucrania",,,
48h,46.32312,30.03459,301.47,16 de agosto,"Comunidad de Starokozatsk Village, distrito de Belgorod-Dnestrovsky, región de Odesa, Ucrania",,,
48h,46.32303,30.02875,314.36,16 de agosto,"Comunidad de Starokozatsk Village, distrito de Belgorod-Dnestrovsky, región de Odesa, Ucrania",,,
48h,46.31868,30.02802,308.35,16 de agosto,"Comunidad de Starokozatsk Village, distrito de Belgorod-Dnestrovsky, región de Odesa, Ucrania",,,
48h,46.31819,30.0341,303.57,16 de agosto,"Comunidad de Starokozatsk Village, distrito de Belgorod-Dnestrovsky, región de Odesa, Ucrania",,,
48h,45.95271,25.27689,298.55,16 de agosto,"DN1S, Cuciulata, Hoghiz, Brașov, 507097, Rumania",,,
48h,45.95249,25.28249,299.36,16 de agosto,"DN1S, Cuciulata, Hoghiz, Brașov, 507097, Rumania",,,
48h,45.37575,30.93014,338.24,16 de agosto,#VALUE!,,,
48h,45.42049,27.97689,301.85,16 de agosto,"Calle de Brezasi, Galați, 800628, Rumania",,,
48h,44.77438,33.85904,307.84,16 de agosto,"Bakhchisarai Bakhchisarai, distrito de Bakhchisarai, República Autónoma de América Krim, 298403, Ucrania",,,
48h,45.12575,25.416,302.99,16 de agosto,"Street Republicii, Fieni, Dâmbovița, 135100, Rumania",,,
48h,45.12403,25.41821,298.63,16 de agosto,"Street Republicii, Fieni, Dâmbovița, 135100, Rumania",,,
48h,44.2219,24.65411,318.02,16 de agosto,"Stoicănești, Olt, Rumania",,,
48h,44.22385,24.65368,315.38,16 de agosto,"Stoicănești, Olt, Rumania",,,
48h,43.96077,24.72831,303.57,16 de agosto,"Slobozia Mândra, Teleorman, 147355, Rumania",,,
48h,42.71397,24.16798,314.1,16 de agosto,"Aurubis Bulgaria, Pirdop, Sofía, 2070, Bulgaria",,,
48h,42.71377,24.17328,303.7,16 de agosto,"Aurubis Bulgaria, Pirdop, Sofía, 2070, Bulgaria",,,
48h,41.17635,32.63693,312.07,16 de agosto,"Gerede-Karabük Road, Almuerzo, Karabük, Karabük Center, Karabük, Región del Mar Negro, 78100, Turquía",,,
48h,41.17336,32.63065,311.65,16 de agosto,"Gerede-Karabük Road, Almuerzo, Karabük, Karabük Center, Karabük, Región del Mar Negro, 78100, Turquía",,,
48h,41.46867,21.55266,301.64,16 de agosto,"FC Mukos, Drenovci, Municipio de Dolneni, Pelagonia SR, Macedonia del Norte",,,
48h,40.76377,32.21838,311.26,16 de agosto,"Ankara-Bolu Road, Yazikoy, Gerede, Bolu, Región del Mar Negro, 14900, Turquía",,,
48h,40.76497,32.21722,311.83,16 de agosto,"Ankara-Bolu Road, Yazikoy, Gerede, Bolu, Región del Mar Negro, 14900, Turquía",,,
48h,41.46706,21.55062,301.32,16 de agosto,"FC Mukos, Drenovci, Municipio de Dolneni, Pelagonia SR, Macedonia del Norte",,,
48h,40.75792,31.78396,304.2,16 de agosto,"Tarakçı, Centro Bolu, Bolu, Región del Mar Negro, Türkiye",,,
48h,41.02176,28.55375,304.48,16 de agosto,"Vecindario Mimarsinan, Büyükçekmece, Estambul, región de Marmara, 34535, Türkiye",,,
48h,41.023,28.5533,307.25,16 de agosto,"Vecindario Mimarsinan, Büyükçekmece, Estambul, región de Marmara, 34535, Türkiye",,,
48h,40.05054,32.64949,305.17,16 de agosto,"Quarter Susuz, Yenimahalle, Ankara, región central de Anatolia, 06980, Türkiye",,,
48h,39.9594,33.14619,307.18,16 de agosto,"Atatürk CD., Hasanoğlan Bahçelievler Barrio, Hasanoğlan, Elmadağ, Ankara, Región Central de Anatolia, 06850, Turquía",,,
48h,39.83807,30.30177,306.25,16 de agosto,"D200, Vecindario Hisar, Poyra, Bozüyük, Bilecik, Región de Mármara, 11300, Turquía",,,
48h,39.57731,29.86161,306.1,16 de agosto,"Seyitömer Mound, 43-79, ̇shak Seydi, Kütahya Center, Kütahya, región del Egeo, Turquía",,,
48h,39.09268,27.51165,306.23,16 de agosto,"Eynez Road, Arpaseki Neighborhood, Soma, Manisa, región del Egeo, 35990, Turquía",,,
48h,39.09299,27.51055,306.08,16 de agosto,"Eynez Road, Arpaseki Neighborhood, Soma, Manisa, región del Egeo, 35990, Turquía",,,
48h,38.66042,30.61595,308.83,16 de agosto,"Halimoru, Centro Afyonkarahisar, Afyonkarahisar, región del Egeo, Türkiye",,,
48h,38.75315,26.95211,312.9,16 de agosto,"Bozköy Neighborhood, Aliağa, Esmir, región del Egeo, 35800, Türkiye",,,
48h,37.93967,32.53484,312.75,16 de agosto,"D715, barrio de Horozluhan, Konya, Selcuklu, Konya, región central de Anatolia, 42050, Turquía",,,
48h,38.42775,27.2178,310.25,16 de agosto,"Çimentaş Esgro de cemento Fábrica, Işıklar Mahallesi, Bornova, región del Egeo, 35080, Turquía",,,
48h,38.25831,28.94888,304.63,16 de agosto,"Karaahmetli, Eşme, USAK, región del Egeo, Türkiye",,,
48h,38.12921,23.52179,303.72,16 de agosto,"Comunidad de Magoula, Unidad Municipal de Magoula, Municipio de Elefsina, Unidad Regional de West Attica, Región de Attica, Administración descentralizada de Attica, 190 18, Grecia, Grecia",,,
48h,36.93647,30.64557,308.61,16 de agosto,"Sur Yapı Area de construcción de transformación urbana de Antalya, Kepez Neighborhood, Kepez, Antalya, región mediterránea, 07220, Turquía",,,
48h,37.46976,22.43167,304.85,16 de agosto,"Extremos, comunidad del estadio, Unidad Municipal de Tegea, Municipio de Trípoli, Unidad Regional de Arcadia, Región Peloponesa, Administración descentralizada de Peloponeso, Occidental Grecia e Ionia, 220 12, Grecia",,,
48h,35.09891,32.84365,328.21,16 de agosto,"Montenegro, Lefke, κύπρος - Chipre",,,
48h,50.83707,29.20162,299.12,17 de agosto,"Pieszhnik, Malinsk City Community, Distrito de Koresten, región de Zhytomyr, 11641, Ucrania",,,
48h,50.54548,26.25926,302.97,17 de agosto,"T-18-01, Cement Plant, Zdolbuniv, Zdolbuniv City Community, Rivne District, Rivne Region, 35350, Ucrania",,,
48h,53.57237,-0.59962,296.76,17 de agosto,"Yarborough Road, British Steel Ltd (Scunthorpe Steelworks), North Lincolnshire, Inglaterra, DN16 1XA, Reino Unido",,,
48h,53.56783,-0.60031,302.62,17 de agosto,"Bos Oprowing Road, British Steel Ltd (Scunthorpe Steelworks), New Brumby, Scunthorpe, North Lincolnshire, Inglaterra, DN16 1AW, Reino Unido",,,
48h,53.54094,-3.58461,319.57,17 de agosto,#VALUE!,,,
48h,52.48746,13.84061,304.01,17 de agosto,"B 1; B 5, Herzfelde, Rüdersdorf cerca de Berlín, Märkisch-Oderland, Brandenburg, 15378, Alemania",,,
48h,47.28115,34.4212,301.48,17 de agosto,"Comunidad de asentamientos de Verkhnorogachytska, distrito de Kakhovsky, región de Kherson, Ucrania",,,
48h,48.44069,29.34754,301.41,17 de agosto,"Demidovka, Comunidad de asentamiento de Trostyanets, Distrito de Gaisinsky, región de Vinnytsia, 24343, Ucrania",,,
48h,52.49236,4.60826,304.05,17 de agosto,"Drijverweg, Tata Steel, Wijk Aan Zee, Beverwijk, Noord-Holland, Nederland, 1951 JZ, Países Bajos",,,
48h,52.49191,4.61624,310.47,17 de agosto,"20040, Tata Steel, Wijk Aan Zee, Beverwijk, Noord-Holland, Nederland, 1951 JZ, Países Bajos",,,
48h,52.48393,4.59082,307.19,17 de agosto,"30362, Tata Steel, Velsen-Noord, Velsen, Noord-Holland, Nederland, 1949 AZ, Países Bajos",,,
48h,46.46724,34.28729,304.64,17 de agosto,"C221511, Novotroitsk Settlement Community, Genichesky District, región de Kherson, 75331, Ucrania",,,
48h,46.46849,34.28597,311.01,17 de agosto,"C221511, Novotroitsk Settlement Community, Genichesky District, región de Kherson, 75331, Ucrania",,,
48h,47.58195,30.83744,304.44,17 de agosto,"COPS, Domanovsky Settlement Community, Distrito de Voznesensky, región de Mykolaiv, 56455, Ucrania",,,
48h,48.75093,26.60239,299.06,17 de agosto,"Cemento Podilsky, 1A, Carretera Khmelnitsky, planta de cemento, Humenets, Humenets Rural Community, Kamianets-Podilskyi District, Región de Khmelnitsky, 32325, Ucrania",,,
48h,47.71449,30.09862,329.42,17 de agosto,"Comunidad de la ciudad de Ananyev, distrito de Podilskyi, región de Odesa, Ucrania",,,
48h,47.71619,30.09324,299.39,17 de agosto,"Comunidad de la ciudad de Ananyev, distrito de Podilskyi, región de Odesa, Ucrania",,,
48h,47.70916,30.09518,341.68,17 de agosto,"Comunidad de la ciudad de Ananyev, distrito de Podilskyi, región de Odesa, Ucrania",,,
48h,47.71081,30.08995,318.86,17 de agosto,"Comunidad de la ciudad de Ananyev, distrito de Podilskyi, región de Odesa, Ucrania",,,
48h,47.59602,30.45002,300.34,17 de agosto,"Comunidad de asentamiento de Lyubashiv, distrito de Podilskyi, región de Odesa, Ucrania",,,
48h,47.5942,30.45568,318.88,17 de agosto,"Comunidad de asentamiento de Lyubashiv, distrito de Podilskyi, región de Odesa, Ucrania",,,
48h,51.40471,13.4428,300.91,17 de agosto,"En la fábrica de acero, Gröditz, Meißen, Sajonia, 01609, Alemania",,,
48h,47.67068,29.96757,297.9,17 de agosto,"M-13, Comunidad de la Ciudad de Ananyev, distrito de Podilskyi, región de ODESA, 66441, Ucrania",,,
48h,46.28703,33.8056,307.5,17 de agosto,"O221802, Pavlovka, Comunidad Rural de Prysovask, Distrito de Kakhovsky, región de Kherson, 75240, Ucrania",,,
48h,50.53437,17.98011,321.77,17 de agosto,"Cementowa, Górażdże Cement S.A., Chorula, Gogolin Commune, Krapkowice Poviat, Opolskie Voivodeship, 47-316, Polonia",,,
48h,50.34373,18.87083,309.03,17 de agosto,"Konstytucji, Carbo-Koks, Bobrek, Bytom, Górnośląsko-zagłębie Metropolia, 41-905, Polonia",,,
48h,46.28603,33.80521,309.31,17 de agosto,"O221802, Pavlovka, Comunidad Rural de Prysovask, Distrito de Kakhovsky, región de Kherson, 75240, Ucrania",,,
48h,50.33245,18.83416,303.45,17 de agosto,"Ziemska, Biskupice, Zabrze, Górnośląsko-zagłębie Metropolia, 41-803, Polonia",,,
48h,50.41833,18.14552,324.23,17 de agosto,"Inversión, Leśnica, Leśnica Commune, Strzelecki Poviat, Opolskie Voivodeship, 47-330, Polonia",,,
48h,48.97697,24.70817,302.91,17 de agosto,"H-09, Yamnytsia, Yamnytska Village Community, Ivano-Frankivsk District, Región de Ivano-Frankivsk, 77422, Ucrania",,,
48h,48.97742,24.70823,297,17 de agosto,"H-09, Yamnytsia, Yamnytska Village Community, Ivano-Frankivsk District, Región de Ivano-Frankivsk, 77422, Ucrania",,,
48h,48.97585,24.71454,300.3,17 de agosto,"Yamnytsia, Comunidad de la aldea de Yamnytska, Distrito de Ivano-Frankivsk, Región de Ivano-Frankivsk, 77422, Ucrania",,,
48h,47.78455,29.01695,307.46,17 de agosto,"Calle industrial, Ayuntamiento de Rybnitsky, Za Rybnitsa / Rybnitsky District / Ribnitzky District, Unitțile administrativ-Theritorialle Din Lifta Nistruului, Nistrieniya / Transnistria / Pridnistrov'ya, MD-0555, Moldova",,,
48h,46.10602,33.4071,300.57,17 de agosto,"Comunidad de Kalanchatska, Distrito de Skadovsky, región de Kherson, Ucrania",,,
48h,46.10278,33.39454,302.56,17 de agosto,"Comunidad de Kalanchatska, Distrito de Skadovsky, región de Kherson, Ucrania",,,
48h,46.09988,33.40253,300.24,17 de agosto,"Comunidad de Kalanchatska, Distrito de Skadovsky, región de Kherson, Ucrania",,,
48h,46.11002,33.41276,300.46,17 de agosto,"O221108, Kalanchatsk Settlement Community, Distrito de Skadovsky, región de Kherson, 75840, Ucrania",,,
48h,46.10388,33.40818,300,17 de agosto,"Comunidad de Kalanchatska, Distrito de Skadovsky, región de Kherson, Ucrania",,,
48h,46.10062,33.39552,307.4,17 de agosto,"Comunidad de Kalanchatska, Distrito de Skadovsky, región de Kherson, Ucrania",,,
48h,49.68493,18.66207,306.26,17 de agosto,"Plataformas 3, Nádražní, Borek, Třinec, Distrito Frýdek-Místek, Región de Moravia-Silsia, Moravia-Silsia, 739 61, República Checa",,,
48h,49.68045,18.66629,317.88,17 de agosto,"Información del autobús, Frýdecká, Staré Město, Třinec, Distrito Frýdek-Místek, Región Moravia-SilESIAN, Moravian-Silesia, 739 61, República Checa",,,
48h,49.67708,18.66475,318.8,17 de agosto,"58, Bezručova, Staré Město, Třinec, Distrito de Frýdek-Místek, Región de Moravia-Silios, Moravian-Silesia, 739 61, República Checa",,,
48h,51.56786,-3.78474,338.82,17 de agosto,"Haul Road, Port Talbot Steelworks, Margam Moors, Port Talbot, Neath Port Talbot, Cymru / Gales, SA13 2Ph, Reino Unido",,,
48h,51.568,-3.77562,305.9,17 de agosto,"Morfa Coke Road, Port Talbot Steelworks, Margam Moors, Neath Port Talbot, Gales, SA13 2ng, Reino Unido",,,
48h,51.57032,-3.78464,329.03,17 de agosto,"Haul Road, Port Talbot Steelworks, Margam Moors, Port Talbot, Neath Port Talbot, Cymru / Gales, SA13 2Ph, Reino Unido",,,
48h,51.57041,-3.7756,319.72,17 de agosto,"Coca -Cola Road, Port Talbot Steelworks, Margam Moors, Neath Port Talbot, Cymru / Gales, SA13 2ng, Reino Unido",,,
