tipo,latitude,longitude,bright,date,admin2,admin3,country_code,country_es
48h,46.54337,34.92254,343.1,18 de agosto,"Comunidad de asentamientos de Yakimovsky, distrito de Melitopol, región de Zaporizhzhya, 72542, Ucrania",,,
48h,45.63478,29.50291,332.2,18 de agosto,"T-16-28, Distrito Nonyshaysky Starostinsky, Nerushay, Comunidad de la Ciudad de Tatarbunar, Distrito de Belgorod-Dnestrovsky, región de Odesa, 68122, Ucrania",,,
48h,46.56111,34.90921,342.64,18 de agosto,"Comunidad de asentamientos de Yakimovsky, distrito de Melitopol, región de Zaporizhzhya, 72542, Ucrania",,,
48h,45.76293,29.77668,344.78,18 de agosto,"C-162406, Trikhatki, Lymansk Village Community, Belgorod-Dnestrovsky District, Región de Odesa, 68142, Ucrania",,,
48h,45.76186,29.77108,335.01,18 de agosto,"C-162406, Trikhatki, Lymansk Village Community, Belgorod-Dnestrovsky District, Región de Odesa, 68142, Ucrania",,,
48h,46.44865,33.52627,341.17,18 de agosto,"Comunidad de asentamiento de Chaplinsk, distrito de Kakhovsky, región de Kherson, Ucrania",,,
48h,46.57235,34.27743,341.2,18 de agosto,"Dmitrovka, Ivanivska Settlement Community, Genichesky District, región de Kherson, 75441, Ucrania",,,
48h,46.58255,34.30026,347.46,18 de agosto,"Dmitrovka, Ivanivska Settlement Community, Genichesky District, región de Kherson, 75441, Ucrania",,,
48h,46.34338,32.75353,341.09,18 de agosto,"Ray, Novomykolaiv Rural Community, Distrito de Skadovsky, región de Kherson, 75711, Ucrania",,,
48h,46.4124,33.16262,367,18 de agosto,"Brylivka, Vynohradivska Comunidad Rural, Distrito de Kherson, región de Kherson, 75143, Ucrania",,,
48h,46.41162,33.15769,367,18 de agosto,"Brylivka, Vynohradivska Comunidad Rural, Distrito de Kherson, región de Kherson, 75143, Ucrania",,,
48h,46.48621,33.63609,341.01,18 de agosto,"Cross Rural Community, Distrito de Kakhovsky, región de Kherson, Ucrania",,,
48h,46.41319,33.16756,335.08,18 de agosto,"Brylivka, Vynohradivska Comunidad Rural, Distrito de Kherson, región de Kherson, 75143, Ucrania",,,
48h,46.41084,33.15276,350.12,18 de agosto,"Brylivka, Vynohradivska Comunidad Rural, Distrito de Kherson, región de Kherson, 75143, Ucrania",,,
48h,46.67876,34.70384,343.06,18 de agosto,"Comunidad de asentamientos de Ivanovo, Distrito Genichesky, región de Kherson, Ucrania",,,
48h,46.30792,32.18179,335.78,18 de agosto,"Mar Negro, Comunidad Rural de Bekhter, distrito de Skadovsky, región de Kherson, 75641, Ucrania",,,
48h,46.61708,33.777,339.98,18 de agosto,"Comunidad de Tavrichan Village, distrito de Kakhovsky, región de Kherson, Ucrania",,,
48h,46.62034,33.77596,346.2,18 de agosto,"Comunidad de la aldea de Zelenopyska, distrito de Kakhovsky, región de Kherson, Ucrania",,,
48h,46.4454,32.57906,340.73,18 de agosto,"Comunidad de la ciudad de Golopristan, distrito de Skadovsky, región de Kherson, Ucrania",,,
48h,46.72177,34.34209,346.97,18 de agosto,"Comunidad de asentamientos de Ivanovo, Distrito Genichesky, región de Kherson, Ucrania",,,
48h,46.75199,34.38498,336.8,18 de agosto,"Comunidad de asentamientos de Ivanovo, Distrito Genichesky, región de Kherson, Ucrania",,,
48h,46.53884,32.96601,343.17,18 de agosto,"Oleshkiv City Community, Distrito de Kherson, región de Kherson, Ucrania",,,
48h,46.70958,34.02813,339.54,18 de agosto,"Comunidad de Tavrichan Village, distrito de Kakhovsky, región de Kherson, Ucrania",,,
48h,46.05538,29.99368,333.11,18 de agosto,"Comunidad de la aldea de Kulevchansk, distrito de Belgorod-Dnestrovsky, región de Odesa, Ucrania",,,
48h,46.91411,34.99658,337.9,18 de agosto,"Comunidad de la aldea de Novuspenivska, Distrito Melitopol, Región de Zaporizhzhya, Ucrania",,,
48h,46.58621,32.8119,340.66,18 de agosto,"Oleshkiv City Community, Distrito de Kherson, región de Kherson, Ucrania",,,
48h,46.57741,32.75729,346.08,18 de agosto,"O221708, Oleshki, Oleshkiv City Community, Distrito de Kherson, región de Kherson, 75101, Ucrania",,,
48h,46.58947,32.81079,343.52,18 de agosto,"Oleshkiv City Community, Distrito de Kherson, región de Kherson, Ucrania",,,
48h,46.57826,32.74128,346.28,18 de agosto,"O221708, Oleshki, Oleshkiv City Community, Distrito de Kherson, región de Kherson, 75101, Ucrania",,,
48h,46.58553,32.76501,332.82,18 de agosto,"Comunidad de la ciudad de Oleshkiv, distrito de Kherson, región de Kherson, 75101, Ucrania",,,
48h,46.60121,32.69153,337,18 de agosto,"Podlisne, Oleshkiv City Community, Distrito de Kherson, región de Kherson, 75108, Ucrania",,,
48h,46.60447,32.69042,341.13,18 de agosto,"Papanina Street, Oleshko, comunidad de la ciudad de Oleshkiv, distrito de Kherson, región de Kherson, 75100, Ucrania",,,
48h,46.69666,33.16133,341.19,18 de agosto,"Oleshkiv City Community, Distrito de Kherson, región de Kherson, Ucrania",,,
48h,46.594970000000004,32.42005,337.17,18 de agosto,"Romashkovo, Romashkovo, Belozersk Settlement Community, Distrito de Kherson, región de Kherson, 75003, Ucrania",,,
48h,46.59742,32.41392,339.56,18 de agosto,"Romashkovo, Romashkovo, Belozersk Settlement Community, Distrito de Kherson, región de Kherson, 75003, Ucrania",,,
48h,46.90854,34.3367,336.65,18 de agosto,"Comunidad de Bajo Sygorod Town, Distrito Genichesky, región de Kherson, Ucrania",,,
48h,46.91182,34.33569,338.38,18 de agosto,"Comunidad de Bajo Sygorod Town, Distrito Genichesky, región de Kherson, Ucrania",,,
48h,46.74497,33.14246,332.83,18 de agosto,"Comunidad de la ciudad de Novokakhovsk, Distrito de Kakhovsky, región de Kherson, Ucrania",,,
48h,46.92674,34.32057,342.69,18 de agosto,"Comunidad de Bajo Sygorod Town, Distrito Genichesky, región de Kherson, Ucrania",,,
48h,46.92445,34.21127,348.46,18 de agosto,"Comunidad de la aldea de Rubanivska, distrito de Kakhovsky, región de Kherson, Ucrania",,,
48h,46.92773,34.21024,340.3,18 de agosto,"Comunidad de la aldea de Rubanivska, distrito de Kakhovsky, región de Kherson, Ucrania",,,
48h,46.65182,32.32895,341.05,18 de agosto,"Tomina Balka, Comunidad de asentamientos de Belozersk, distrito de Kherson, región de Kherson, 75004, Ucrania",,,
48h,46.99773,34.55086,339.64,18 de agosto,"Comunidad de Bajo Sygorod Town, Distrito Genichesky, región de Kherson, Ucrania",,,
48h,47.0849,34.99627,341.94,18 de agosto,"Comunidad de asentamientos de Mikhailovsky, distrito de Vasylivsky, región de Zaporizhzhya, Ucrania",,,
48h,46.88746,33.6433,335.22,18 de agosto,"Comunidad de asentamiento de Lyubimivska, Distrito de Kakhovsky, región de Kherson, Ucrania",,,
48h,46.8867,33.63832,307.2,18 de agosto,"Comunidad de asentamiento de Lyubimivska, Distrito de Kakhovsky, región de Kherson, Ucrania",,,
48h,47.0882,34.99529,346.25,18 de agosto,"Comunidad de asentamientos de Mikhailovsky, distrito de Vasylivsky, región de Zaporizhzhya, Ucrania",,,
48h,46.70419,32.45871,347.48,18 de agosto,"M-14, Distrito de Ship, Comunidad de Kherson City, Distrito de Kherson, región de Kherson, 75015, Ucrania",,,
48h,47.12429,34.50453,340.93,18 de agosto,"Comunidad de asentamientos de Verkhnorogachytska, distrito de Kakhovsky, región de Kherson, Ucrania",,,
48h,46.80383,32.31088,336.29,18 de agosto,"Kopani, Comunidad de la aldea de Chernobayivska, Distrito de Kherson, región de Kherson, 75010, Ucrania",,,
48h,47.14586,34.46873,337.64,18 de agosto,"Comunidad de asentamientos de Verkhnorogachytska, distrito de Kakhovsky, región de Kherson, 74441, Ucrania",,,
48h,47.14514,34.46367,341.79,18 de agosto,"Comunidad de asentamientos de Verkhnorogachytska, distrito de Kakhovsky, región de Kherson, 74441, Ucrania",,,
48h,47.14441,34.45861,346.44,18 de agosto,"Comunidad de asentamientos de Verkhnorogachytska, distrito de Kakhovsky, región de Kherson, 74441, Ucrania",,,
48h,47.18118,34.54778,351.53,18 de agosto,"Comunidad rural de Greater Belozersk, distrito de Vasylivskyi, Región de Zaporizhzhya, Ucrania",,,
48h,46.95229,32.97915,344.79,18 de agosto,"O220120, Chaykine, Daryevskaya Village Community, Distrito de Kherson, región de Kherson, 74322, Ucrania",,,
48h,46.98991,33.19712,338.08,18 de agosto,"Comunidad de la ciudad de Berislav, distrito de Beryslav, región de Kherson, Ucrania",,,
48h,47.18345,34.42012,338.43,18 de agosto,"Comunidad de asentamientos de Verkhnorogachytska, distrito de Kakhovsky, región de Kherson, Ucrania",,,
48h,46.98251,32.95322,347.99,18 de agosto,"Vitrove, Daryevsky Village Community, Distrito de Kherson, región de Kherson, 74321, Ucrania",,,
48h,46.98172,32.94823,352.47,18 de agosto,"Vitrove, Daryevsky Village Community, Distrito de Kherson, región de Kherson, 74321, Ucrania",,,
48h,47.21628,34.45757,343.53,18 de agosto,"Comunidad de asentamientos de Verkhnorogachytska, distrito de Kakhovsky, región de Kherson, 74405, Ucrania",,,
48h,47.21555,34.45251,350.4,18 de agosto,"Comunidad de asentamientos de Verkhnorogachytska, distrito de Kakhovsky, región de Kherson, 74405, Ucrania",,,
48h,47.21482,34.44744,336.51,18 de agosto,"Comunidad de asentamientos de Verkhnorogachytska, distrito de Kakhovsky, región de Kherson, Ucrania",,,
48h,46.98903,32.95102,350.31,18 de agosto,"Vitrove, Daryevsky Village Community, Distrito de Kherson, región de Kherson, 74321, Ucrania",,,
48h,47.28222,34.63589,342.86,18 de agosto,"Comunidad rural de Greater Belozersk, distrito de Vasylivskyi, Región de Zaporizhzhya, Ucrania",,,
48h,47.2815,34.63079,346.02,18 de agosto,"Comunidad rural de Greater Belozersk, distrito de Vasylivskyi, Región de Zaporizhzhya, Ucrania",,,
48h,47.26097,34.31905,331.06,18 de agosto,"T-22-08, Upper Rogachyk, Verkhnorogachytska Community, Distrito de Kakhovsky, región de Kherson, 74400, Ucrania",,,
48h,46.51061,29.64312,333.81,18 de agosto,"Ștefan Voda, Distrito Stefan Voda, MD-4201, Moldavia",,,
48h,47.32469,34.2621,339.56,18 de agosto,"Comunidad de asentamientos de Verkhnorogachytska, distrito de Kakhovsky, región de Kherson, Ucrania",,,
48h,47.35385,33.88058,336.09,18 de agosto,"T-04-03, Novooleksandrivska Comunidad rural, distrito de Beryslav, región de Kherson, 74200, Ucrania",,,
48h,47.35712,33.87953,334.6,18 de agosto,"T-04-03, Novooleksandrivska Comunidad rural, distrito de Beryslav, región de Kherson, 74200, Ucrania",,,
48h,47.35637,33.87449,334.15,18 de agosto,"Novooleksandrovsk Village Community, Distrito de Beryslav, región de Kherson, Ucrania",,,
48h,47.4068,33.63976,349.48,18 de agosto,"O221404, Myrolyubivka, Novovorontsovsky City Community, distrito de Beryslav, región de Kherson, 74211, Ucrania",,,
48h,47.41584,33.63155,343.51,18 de agosto,"T-22-07, Novovoznesenskoe, Vysokopolsky Settlement Community, Distrito de Beryslav, región de Kherson, 74042, Ucrania",,,
48h,47.41828,33.55694,337.02,18 de agosto,"Veremiyivka, Kostyrka, Vysokopolsky Settlement Community, distrito de Beryslav, región de Kherson, 74042, Ucrania",,,
48h,47.42154,33.55587,335.44,18 de agosto,"Kostyrka, Vysokopolsky Settlement Community, distrito de Beryslav, región de Kherson, 74042, Ucrania",,,
48h,47.2784,32.54842,345.96,18 de agosto,"Comunidad de la ciudad de Bashtansk, distrito de Bashtansky, región de Mykolaiv, Ucrania",,,
48h,47.277589999999996,32.54339,335.37,18 de agosto,"Comunidad de la ciudad de Bashtansk, distrito de Bashtansky, región de Mykolaiv, Ucrania",,,
48h,47.28166,32.54729,338.2,18 de agosto,"O150214, Vidyn, Bashtansk City Community, Distrito de Bashtansky, región de Mykolaiv, 56166, Ucrania",,,
48h,47.28085,32.54226,336.49,18 de agosto,"Comunidad de la ciudad de Bashtansk, distrito de Bashtansky, región de Mykolaiv, Ucrania",,,
48h,47.33298,32.56922,347.81,18 de agosto,"Tracto Novobratske, comunidad de la ciudad de Bashtansk, distrito de Bashtansky, región de Mykolaiv, 56153, Ucrania",,,
48h,46.61549,28.29903,330.23,18 de agosto,"Distrito Hîncești, Moldavia",,,
48h,46.61427,28.29292,330.53,18 de agosto,"Distrito de Leova, Moldavia",,,
48h,46.86831,29.55977,341.59,18 de agosto,"Un vertedero, una carretera de derivación, un asentamiento de ladrillos, aconsejó al Tirazpol Orplan / Tiraspol City Council / Tiraspol Miski Rada, Unitțile administratoria Din Stuffa Nistruului, Nibing / Transnistria / Transdnistrovi, MD-3300, Moldovava",,,
48h,46.86836,29.55838,342.64,18 de agosto,"Un vertedero, una carretera de derivación, un asentamiento de ladrillos, aconsejó al Tirazpol Orplan / Tiraspol City Council / Tiraspol Miski Rada, Unitțile administratoria Din Stuffa Nistruului, Nibing / Transnistria / Transdnistrovi, MD-3300, Moldovava",,,
48h,46.61794,28.29725,332.59,18 de agosto,"Distrito Hîncești, Moldavia",,,
48h,46.87523,29.55564,338.68,18 de agosto,"Dot No. 920 Tuir, Flower Street, Sot ""Cheromukha"", aconsejó a la Orleshenesk Tiraspol / Tiraspol City Council / Tiraspoli Miskka Rada, Unitțile administrador-teteritorialle din lleno nistruului, nitrógeno / transdnistrovi, md-5727, moldavavavavavavavavava",,,
48h,46.87415,29.55003,343.51,18 de agosto,"Dot No. 920 Tuir, Flower Street, Sot ""Cheromukha"", aconsejó a la Orleshenesk Tiraspol / Tiraspol City Council / Tiraspoli Miskka Rada, Unitțile administrador-teteritorialle din lleno nistruului, nitrógeno / transdnistrovi, md-5727, moldavavavavavavavavava",,,
48h,47.38306,32.32626,340.27,18 de agosto,"Vyshneva Street, Novrakhovo, Comunidad de la Ciudad de Bashtansk, distrito de Bashtansky, región de Mykolaiv, 56143, Ucrania",,,
48h,47.0905,30.53786,337.75,18 de agosto,"Comunidad de la aldea de Konoplyanska, distrito de Berezovsky, región de Odesa, Ucrania",,,
48h,47.42294,32.0465,336.17,18 de agosto,"Comunidad de la aldea de Sukhoelanetsky, distrito de Mykolaiv, región de Mykolaiv, Ucrania",,,
48h,45.09109,21.29839,328.05,18 de agosto,"Zudova, MZ Zarko Zrenjanin, Vrsac, Vršac City, Južnobanatski Upravni Okrug, Vojvodina, 23600, Serbia",,,
48h,47.46867,32.03013,339.02,18 de agosto,"Comunidad de la aldea de Sukhoelanetsky, distrito de Mykolaiv, región de Mykolaiv, Ucrania",,,
48h,47.55735,32.42681,338.29,18 de agosto,"Tracto Novoantonovka, Vilni -zaporizhsky Village Community, Distrito de Bashtansky, región de Mykolaiv, 56121, Ucrania",,,
48h,47.13424,29.55547,340.22,18 de agosto,"Consejo de la aldea de Shipkinsky, Zaled the Grigoriopol / Grigoriopolsky District / Grigoriopolsky District, UnitțIle Administrativ-TheteterAly Din Stînga nistruului, Nylumania / Transnistria / Pridnistrov'ya, Moldova",,,
48h,47.29877,30.36625,341.89,18 de agosto,"Field, Comunidad Rural de Petroviriv, Distrito de Berezovsky, Región de Odesa, 66860, Ucrania",,,
48h,44.92559,20.08858,367,18 de agosto,"Vojka, Opština Stara Pazova, Sremski Upravni Okrug, Vojvodina, 22313, Serbia",,,
48h,44.92419,20.08377,350.4,18 de agosto,"Vojka, Opština Stara Pazova, Sremski Upravni Okrug, Vojvodina, 22313, Serbia",,,
48h,47.86024,33.4481,337.98,18 de agosto,"Novopolsk Village Community, Distrito de Kryvyi Rih, región de Dnipropetrovsk, Ucrania",,,
48h,47.86793,33.43221,330.95,18 de agosto,"Conjunto Stock Street, Distrito Metalúrgico, Kryvyi Rih, Kryvyi Rih City Community, Distrito Kryvyi Rih, región de Dnipropetrovsk, 50103, Ucrania",,,
48h,47.30431,30.0666,343.3,18 de agosto,"Makarove, Shiryaevsk Settlement Community, distrito de Berezovsky, región de Odesa, 66840, Ucrania",,,
48h,44.92493,20.08617,367,18 de agosto,"Vojka, Opština Stara Pazova, Sremski Upravni Okrug, Vojvodina, 22313, Serbia",,,
48h,47.31305,30.07477,336.32,18 de agosto,"Comunidad de asentamientos de Shiryaevsky, distrito de Berezovsky, región de Odesa, Ucrania",,,
48h,44.92351,20.08138,334.77,18 de agosto,"Vojka, Opština Stara Pazova, Sremski Upravni Okrug, Vojvodina, 22313, Serbia",,,
48h,47.40055,30.13894,338.64,18 de agosto,"PODILTSI, SHIRYAEVSKY SECUSTLE COMUNIDAD, DISTRITO DE BEREZOVSKY, Región de ODESA, 66802, Ucrania",,,
48h,47.81124,31.5875,346.66,18 de agosto,"Shevchenko, comunidad de asentamientos fraternales, distrito de Voznesensky, región de Mykolaiv, 55470, Ucrania",,,
48h,47.79396,31.40247,342.73,18 de agosto,"C-150103, New Pond, Arbuzinsk Settlement Community, District Pervomaisk, región de Mykolaiv, 55354, Ucrania",,,
48h,47.75328,30.8187,336.58,18 de agosto,"El tramo de Nezabolotsk, Domanovsky Settlement Community, District Voznesensky, región de Mykolaiv, 56429, Ucrania",,,
48h,47.7575,30.8227,335.28,18 de agosto,"El tramo de Nezabolotsk, Domanovsky Settlement Community, District Voznesensky, región de Mykolaiv, 56429, Ucrania",,,
48h,47.44375,28.89004,334.93,18 de agosto,"Distrito de Orhei, Moldavia",,,
48h,48.4733,34.63061,332.67,18 de agosto,"R-80, Distrito Sur, Kamianske, Comunidad de la Ciudad de Kamiansk, Distrito de Kamyansky, región de Dnipropetrovsk, 52050, Ucrania",,,
48h,48.51858,34.63334,333.88,18 de agosto,"Hospital Street, Southern District, Kamianske, Kamiansk City Community, Distrito de Kamyansky, región de Dnipropetrovsk, 51911, Ucrania",,,
48h,48.39274,32.78625,351.32,18 de agosto,"Comunidad de asentamientos de Novgorod, distrito de Kropyvnytskyi, región de Kirovohrad, Ucrania",,,
48h,48.39679,32.79023,332.06,18 de agosto,"Comunidad de asentamientos de Novgorod, distrito de Kropyvnytskyi, región de Kirovohrad, Ucrania",,,
48h,48.396,32.78512,336.06,18 de agosto,"Comunidad de asentamientos de Novgorod, distrito de Kropyvnytskyi, región de Kirovohrad, Ucrania",,,
48h,45.66977,20.22672,337.18,18 de agosto,"15, Novi Bečej, municipio de Novi Bečej, Srednjobanatski Upravni Okrug, Vojvodina, 23273, Serbia",,,
48h,47.70456,28.28599,338.98,18 de agosto,"Alexiuca, distrito de Sîngerei, Moldavia",,,
48h,48.30875,30.48585,336.43,18 de agosto,"Svirneve, Golovanivska Settlement Community, Golovanivskyi District, región de Kirovohrad, 26542, Ucrania",,,
48h,48.08486,29.00336,332.69,18 de agosto,"Comunidad de Kodyma City, distrito de Podilskyi, región de Odesa, Ucrania",,,
48h,49.00221,34.57819,330.69,18 de agosto,"Novoselovskaya Street, Kushchivka, Comunidad de la ciudad de Tsarichansk, distrito de Dniprovsky, región de Dnipropetrovsk, 51010, Ucrania",,,
48h,48.54131,29.57485,335.19,18 de agosto,"Methanivka, Comunidad de la aldea Sobolovsk, distrito de Gaysinsky, región de Vinnytsia, 23831, Ucrania",,,
48h,49.33166,31.43296,335.81,18 de agosto,"Nabokov, Horrodyshche City Community, Cherkasy District, Cherkasy Region, 19508, Ucrania",,,
48h,49.83731,30.61838,345.07,18 de agosto,"Persenivka, Comunidad de la ciudad de Kagarlytska, distrito de Obukhov, región de Kiev, 09244, Ucrania",,,
48h,50.23464,32.3679,329.24,18 de agosto,"Oleksandrivka, Piryatinsk City Community, Distrito de Lubensky, región de Poltava, 37004, Ucrania",,,
48h,50.01289,27.99665,333,18 de agosto,"Comunidad de asentamientos de Romanivska, distrito de Zhytomyr, región de Zhytomyr, Ucrania",,,
48h,50.3884,29.92021,342.03,18 de agosto,"Domashenkova Street, Motyzhin, Comunidad de la ciudad de Makarivska, distrito de Buchan, región de Kiev, 08060, Ucrania",,,
48h,48.61287,21.19939,330.78,18 de agosto,"454, Sokoľany, 044 57, Eslovaquia",,,
48h,48.60712,21.1779,331.11,18 de agosto,"1387, Košice - Distrito de ŠACA, Košice II Distrito, Košice, región de Košice, Eslovaquia Oriental, 040 15, Eslovaquia",,,
48h,50.75139,31.05545,339.17,18 de agosto,"C-100614, Kalita, Comunidad de asentamiento de Kityansk, Distrito de Brovarsky, región de Kiev, 07420, Ucrania",,,
48h,50.68885,30.23874,341.98,18 de agosto,"Compañía de responsabilidad limitada ""Agromars Complex"", O-100804, Buchan City Community, Distrito de Buchan, región de Kiev, 07350, Ucrania",,,
48h,50.6921,30.23737,350.34,18 de agosto,"Compañía de responsabilidad limitada ""Agromars Complex"", Buchan City Community, distrito de Bucchansky, región de Kiev, Ucrania",,,
48h,50.69119,30.23195,346.98,18 de agosto,"Compañía de responsabilidad limitada ""Agromars Complex"", Buchan City Community, distrito de Bucchansky, región de Kiev, Ucrania",,,
48h,50.69027,30.22653,336.56,18 de agosto,"Havrylivka, Buchan City Community, distrito de Buchan, región de Kiev, 07350, Ucrania",,,
48h,50.69445,30.23059,338.21,18 de agosto,"Compañía de responsabilidad limitada ""Agromars Complex"", Buchan City Community, distrito de Bucchansky, región de Kiev, Ucrania",,,
48h,50.69353,30.22518,331.14,18 de agosto,"Havrylivka, Buchan City Community, distrito de Buchan, región de Kiev, 07350, Ucrania",,,
48h,50.70057,30.20481,338.38,18 de agosto,"Compañía de responsabilidad limitada ""Agromars Complex"", Buchan City Community, distrito de Bucchansky, región de Kiev, 07358, Ucrania",,,
48h,50.69873,30.19396,342.1,18 de agosto,"Compañía de responsabilidad limitada ""Agromars Complex"", Buchan City Community, distrito de Bucchansky, región de Kiev, 07358, Ucrania",,,
48h,50.70199,30.19258,348.59,18 de agosto,"Compañía de responsabilidad limitada ""Agromars Complex"", Buchan City Community, distrito de Bucchansky, región de Kiev, 07358, Ucrania",,,
48h,50.70668,30.17898,341.21,18 de agosto,"Compañía de responsabilidad limitada ""Agromars Complex"", Buchan City Community, distrito de Bucchansky, región de Kiev, 07358, Ucrania",,,
48h,51.22567,31.3546,331.03,18 de agosto,"Gazopovid Street, Olyshivka, Olyshivska City Community, District de Chernihiv, región de Chernihiv, 15576, Ucrania",,,
48h,51.69057,34.10287,336.49,18 de agosto,"Studenok, Esman Village Community, Shostka District, Región Sumy, 41441, Ucrania",,,
48h,52.05674,30.47216,342.87,18 de agosto,"N4165, Sección de Goncharov, Consejo de la Aldea Vyshamirsk, Distrito de Rechitsa, Región de Gomel, Bielorrusia",,,
48h,48.95753,16.09113,343.48,18 de agosto,"Mikulovice U Znojmo, Mikulovice, Distrito Znojmo, Región de Moravia del Sur, Sudeste, 671 33, República Checa",,,
48h,48.95889,16.09028,347.71,18 de agosto,"3983, Mikulovice U Znojmo, Mikulovice, Distrito Znojmo, Región de Moravia del Sur, Sudeste, 671 33, República Checa",,,
48h,53.03005,33.03919,328.84,18 de agosto,"Divovka, Vetlevsk Rural Settlement, Distrito de Mglinsky, Región de Bryansk, Distrito Federal Central, 243224, Rusia",,,
48h,53.02926,33.03332,327.92,18 de agosto,"Vetlevsk Rural Settlement, distrito de Mglinsky, región de Bryansk, distrito federal central, Rusia",,,
48h,53.44265,34.41603,333.66,18 de agosto,"CJSC ""Maltsovsky Portland Cement"", Promokzalnaya Street, Fokino, Distrito de la Ciudad de Fokino, Región de Bryansk, Distrito Federal Central, 242610, Rusia",,,
48h,53.44444,34.42059,326.64,18 de agosto,"Bazaraya Street, Fokino, Distrito de la Ciudad de Fokino, Región de Bryansk, Distrito Federal Central, 242610, Rusia",,,
48h,52.84513,29.98926,329.36,18 de agosto,"Planta Metalúrgica Bielorrusia, H4326, Salanoe, Consejo Rural de Salón, distrito de Zhlobin, región de Gomel, 247220, Bielorrusia",,,
48h,50.4125,18.14392,334.58,18 de agosto,"Filarski, Osiedle Piastów, Zdzieszowice, Zdzieszowice Commune, Krapkowice Poviat, Opolskie Voivodeship, 47-330, Polonia",,,
48h,53.13145,25.83186,339.01,18 de agosto,"Fábrica de aves de corral ""Druzhba"", Pearl Village Council, Distrito de Baranavichy, Región de Brest, Bielorrusia",,,
48h,53.1374,25.8428,336.62,18 de agosto,"H273, Pearl Rural Council, Distrito de Baranavichy, Región de Brest, 22533, Bielorrusia",,,
48h,54.48711,32.47255,326.21,18 de agosto,"Asentamiento rural de Muryginsky, distrito de Pochinkovsky, región de Smolensk, distrito federal central, Rusia",,,
48h,54.48548,32.46038,332.23,18 de agosto,"Asentamiento rural de Muryginsky, distrito de Pochinkovsky, región de Smolensk, distrito federal central, Rusia",,,
48h,54.48466,32.45431,340.27,18 de agosto,"Asentamiento rural de Muryginsky, distrito de Pochinkovsky, región de Smolensk, distrito federal central, Rusia",,,
48h,51.1769,16.11333,330.46,18 de agosto,"Dolnośląskie Voivodeship, 59-220, Polonia",,,
48h,51.68719,15.98236,335.84,18 de agosto,"Huta Miedzi ""Głogów"", 292, Kłoda, żukowice Commune, Głogów Poviat, Dolnośląskie Voivodeship, 67-232, Polonia",,,
48h,55.05782,25.78397,342.21,18 de agosto,"Anterna Pabrade, Municipio del Distrito de Švenčionys, Condado de Vilnius, Lituania",,,
48h,51.88124,12.58053,326.43,18 de agosto,"Möllensdorfer Straße, Piesteritz, Wittenberg, Sajonia-Anhalt, 06886, Alemania",,,
48h,54.9596,22.28818,334.69,18 de agosto,"27A-025, Petropavlovskoye, Kalacheevo, Krasnoznamensky Municipal District, región de Kaliningrado, Distrito Federal del Noroeste, 238732, Rusia",,,
48h,52.15115,10.40567,325.63,18 de agosto,"HauptMagazin, Stahlwerkstraße, Salzgitter Flachstahl GmbH, Watenstedt, Town East, Salzgitter, Lower Sajonia, 38239, Alemania",,,
48h,54.13653,12.30856,327.64,18 de agosto,"Werkstrasse, Yara Rostock, Mandelshagen, Poppendorf, Carbäk, Rostock, Mecklenburg-Western Pomerania, 18184, Alemania",,,
48h,58.61628,31.23309,327.27,18 de agosto,"Vyazhishishchi Viajes, Distrito de la Ciudad de Veliky Novgorod, Región de Novgorod, Distrito Federal del Noroeste, 173507, Rusia",,,
48h,59.6088,1.51708,331.73,18 de agosto,#VALUE!,,,
48h,65.76402,24.18719,329.46,18 de agosto,"Terästie, Röytt, Tornio, región de Kemi-Tornio, Oficina del Gobierno Regional de Laponia, Manny-Suomi, 95490, Finlandia / Finlandia",,,
48h,65.76839,24.1927,345.05,18 de agosto,"Terästie, Röytt, Tornio, región de Kemi-Tornio, Oficina del Gobierno Regional de Laponia, Manny-Suomi, 95490, Finlandia / Finlandia",,,
48h,35.34797,5.76257,344.92,18 de agosto,"RN 28, The Société des Ciments de Ain-Touta Scimat, Legridet, Tilatou ⵜⵉⵍⴰⵜⵓ omin.",,,
48h,37.09709,14.36564,345.86,18 de agosto,"Gela, Caltanissetta, Sicilia, 93012, Italia",,,
48h,37.088,14.29531,343,18 de agosto,"Cuarta carretera, North 1 Sector, Gela, Caltanissetta, Sicilia, 93012, Italia",,,
48h,37.38958,14.62698,340.27,18 de agosto,"SP103, Ramacca, Catania, Sicilia, 95040, Italia",,,
48h,37.39062,14.62881,342.8,18 de agosto,"SP103, Ramacca, Catania, Sicilia, 95040, Italia",,,
48h,37.34824,13.83018,350.39,18 de agosto,"Provincial Road 78, Naro, Agrigento, Sicilia, 92028, Italia",,,
48h,37.39905,13.76376,351.91,18 de agosto,"Racalmuto, Agrigento, Sicilia, 92020, Italia",,,
48h,37.39845,13.75922,336.97,18 de agosto,"Racalmuto, Agrigento, Sicilia, 92020, Italia",,,
