tipo,latitude,longitude,bright,date,admin2,admin3,country_code,country_es
48h,49.68027,18.66596,305.83,19 de agosto,"410, Frýdecká, Staré Město, Třinec, Distrito Frýdek-Místek, Región Moravia-SilESIAN, Moravian-Silesia, 739 61, República Checa",,,
48h,46.77976,34.39614,316.76,19 de agosto,"Comunidad de asentamientos de Ivanovo, Distrito Genichesky, región de Kherson, Ucrania",,,
48h,49.89463,15.64101,300.9,19 de agosto,"302, Factory, Prachovice, Distrito de Chrudim, Región de Pardubice, Noreste, 538 04, República Checa",,,
48h,46.70549,34.28286,305.95,19 de agosto,"Comunidad de asentamientos de Ivanovo, Distrito Genichesky, región de Kherson, Ucrania",,,
48h,46.70103,34.2804,321.02,19 de agosto,"Comunidad de asentamientos de Ivanovo, Distrito Genichesky, región de Kherson, Ucrania",,,
48h,47.7852,29.01477,305.94,19 de agosto,"Calle industrial, Ayuntamiento de Rybnitsky, Za Rybnitsa / Rybnitsky District / Ribnitzky District, Unitțile administrativ-Theritorialle Din Lifta Nistruului, Nistrieniya / Transnistria / Pridnistrov'ya, MD-0555, Moldova",,,
48h,49.95614,9.76827,312.43,19 de agosto,"11, Laudenbacher Weg, Área industrial Laudenbacher Weg, Karlstadt, Laudenbach, Karlstadt, Distrito de Main-Spessart, Baviera, 97753, Alemania",,,
48h,47.27576,30.3547,312.59,19 de agosto,"Petrovirivska Village Community, distrito de Berezovsky, región de Odesa, Ucrania",,,
48h,47.27198,30.35298,306.75,19 de agosto,"Petrovirivska Village Community, distrito de Berezovsky, región de Odesa, Ucrania",,,
48h,46.66498,32.66256,334.23,19 de agosto,"Shell, Perekopskaya Street, HBC, Distrano de Dniprovskyi, Kherson, Kherson City Community, Distrito de Kherson, región de Kherson, 73036, Ucrania",,,
48h,46.61147,32.68803,304.17,19 de agosto,"Levanevsky Street, Oleshko, comunidad de la ciudad de Oleshkiv, distrito de Kherson, región de Kherson, 75100, Ucrania",,,
48h,49.21817,16.77233,300.29,19 de agosto,"Nebosada, Sivice, Distrito Brno-Venkov, Región de Moravia del Sur, Sudeste, 664 07, República Checa",,,
48h,46.59143,32.42566,340.23,19 de agosto,"O220201, Romashkovo, Giant, Belozersk Settlement Community, Distrito de Kherson, región de Kherson, 75003, Ucrania",,,
48h,47.19294,29.51335,300.79,19 de agosto,"Consejo de la aldea de Shipkinsky, Zaled the Grigoriopol / Grigoriopolsky District / Grigoriopolsky District, UnitțIle Administrativ-TheteterAly Din Stînga nistruului, Nylumania / Transnistria / Pridnistrov'ya, Moldova",,,
48h,48.61652,21.18468,309.93,19 de agosto,"1301, Košice - Distrito de ŠACA, Košice II Distrito, Košice, región de Košice, Eslovaquia Oriental, 040 15, Eslovaquia",,,
48h,48.61169,21.19469,302.72,19 de agosto,"1688, Košice - Distrito de ŠACA, Košice II Distrito, Košice, región de Košice, Eslovaquia Oriental, 040 15, Eslovaquia",,,
48h,48.60711,21.17608,321.71,19 de agosto,"1413, Košice - Distrito de ŠACA, Košice II Distrito, Košice, región de Košice, Eslovaquia Oriental, 040 15, Eslovaquia",,,
48h,48.60638,21.1816,319.13,19 de agosto,"1427, Košice - Distrito de ŠACA, Košice II Distrito, Košice, región de Košice, Eslovaquia Oriental, 040 15, Eslovaquia",,,
48h,48.60301,21.18057,306.87,19 de agosto,"1390, Košice - Distrito de ŠACA, Košice II Distrito, Košice, región de Košice, Eslovaquia Oriental, 040 15, Eslovaquia",,,
48h,47.13338,29.56538,304.66,19 de agosto,"Novooleksandrivka, Velikomykhailivska City Community, Razdelnyansky District, Región de ODESA, 67114, Ucrania",,,
48h,46.14515,33.40768,301.33,19 de agosto,"Privilia, O221107, Kalanchatka Settlement Community, Distrito de Skadovsky, región de Kherson, 75811, Ucrania",,,
48h,46.13668,33.3443,304.83,19 de agosto,"O221107, Kalanchatsk Settlement Community, Distrito de Skadovsky, región de Kherson, 75813, Ucrania",,,
48h,49.35885,6.74627,317.59,19 de agosto,"L 143, Dillingen, Dillingen/Saar, Distrito de Saarlouis, Saarland, 66763, Alemania",,,
48h,49.24873,6.8448,307.94,19 de agosto,"Sitio del Patrimonio Mundial Völklinger Hütte, 75-79, Rathausstraße, Völklingen, Asociación Regional Saarbrücken, Saarland, 66333, Alemania",,,
48h,49.24871,6.85244,297.47,19 de agosto,"South Tangente, Völklingen, Asociación Regional Saarbrücken, Saarland, 66333, Alemania",,,
48h,49.24529,6.8445,304.84,19 de agosto,"Schrottallee, Saarstahl, Völklingen, Asociación Regional Saarbrücken, Saarland, 66333, Alemania",,,
48h,49.24523,6.85209,302.18,19 de agosto,"Schlackenstrasse, Saarstahl, Völklingen, Asociación Regional de Saarbrücken, Saarland, 66333, Alemania",,,
48h,48.45684,17.19081,304.93,19 de agosto,"475, Rohožník, Distrito Malacky, Región de Bratislava, 906 38, Eslovaquia",,,
48h,48.77806,10.69918,302.65,19 de agosto,"Bahnhofstraße, Märker Kalk GmbH, Brünsee, Harburg (Schwaben), Donau-Ries, Bavaria, 86655, Alemania",,,
48h,48.65514,10.16273,300.41,19 de agosto,"B 19, Mergelstetten, Heidenheim an Der Brenz, Comunidad Administrativa Heidenheim A Der Brenz, Distrito de Heidenheim, Baden-Württemberg, 89522, Alemania",,,
48h,48.28431,14.32827,329.95,19 de agosto,"Donau Bundestraße, Chemiepark Linz, Industriebiet-Haat, Linz, Austria superior, 4020, Austria",,,
48h,48.27942,14.33401,332.48,19 de agosto,"Wasser Tower Road, Linz Chemical Park, Industriebiet-Haat, Linz, 4020, Austria",,,
48h,48.27893,14.34047,306.99,19 de agosto,"Baustoffstraße, Linz Chemical Park, Puerto de Área Industrial, Linz, 4020, Austria",,,
48h,48.27846,14.34692,313.56,19 de agosto,"Schwerlast Straße, Linz Chemiepark, Industriebiet-Haat, Linz, 4020, Austria",,,
48h,48.27452,14.33974,320.1,19 de agosto,"Zentrostrasse, Puerto del Área Industrial, Linz, Upper Austria, 4020, Austria",,,
48h,48.27499,14.33329,300.48,19 de agosto,"Stahlwerkstraße West, Puerto del Área Industrial, Linz, 4020, Austria",,,
48h,48.2701,14.33901,302.72,19 de agosto,"Molino cálido, manguera de molino, puerto industrial, Linz, 4020, Austria",,,
48h,48.2533,12.53981,303.62,19 de agosto,"Bürgermeister-Hess-Straße, Hölzling, Hart, Mühldorf a. Inn, Distrito de Mühldorf Am Inn, Baviera, 84453, Alemania",,,
48h,48.33283,9.7306,309.59,19 de agosto,"Schwenk Zement KG, Großallmendingen, Allmendingen, Asociación de Administración Municipal Allmendingen, Alb-Donau-Kreis, Baden-Württemberg, 89604, Alemania",,,
48h,48.1975,12.84277,300.61,19 de agosto,"Omv Deutschland GmbH, Aö 24, Burghausen, Distrito de Altötting, Baviera, 84489, Alemania",,,
48h,48.19688,12.84297,300.37,19 de agosto,"Omv Deutschland GmbH, Aö 24, Burghausen, Distrito de Altötting, Baviera, 84489, Alemania",,,
48h,48.33271,9.73399,301.03,19 de agosto,"Siegentalweg, Großallmendingen, Allmendingen, Asociación de Administración Municipal Allmendingen, Alb-Donau-Kreis, Baden-Württemberg, 89604, Alemania",,,
48h,44.77257,33.86269,306.51,19 de agosto,"City Village Bachchisarai, distrito de Bakhchisarai, 298403, Ucrania",,,
48h,45.37337,30.92978,338.71,19 de agosto,#VALUE!,,,
48h,46.94261,18.93921,303.71,19 de agosto,"ISD-DUNAFERR, 6, Kisapostag, distrito de DunaúJváros, condado de Fejér, Transdanubia, 2428, Hungría",,,
48h,45.95284,25.28123,300.55,19 de agosto,"DN1S, Cuciulata, Hoghiz, Brașov, 507097, Rumania",,,
48h,45.41803,27.97876,310.64,19 de agosto,"Aggler Machine, Brăilei Street, Galați, 800628, Rumania",,,
48h,45.95515,22.86712,305.68,19 de agosto,"DJ706A, Chiscădaga, şoimuș, Hunedoara, 337457, Rumania",,,
48h,47.17652,7.56142,308.87,19 de agosto,"46b, Dammstrasse, biberista, distrito de Wasseramt, oficina de Bucheggberg-Wasseramt, Solothurn, 4562, Suiza/Suisse/Svizzera/Svizra",,,
48h,44.24217,28.30835,302.68,19 de agosto,"Medgidia, Constanța, 905600, Rumania",,,
48h,46.05966,13.86899,299.79,19 de agosto,"Idrija, Eslovenia",,,
48h,46.06889,13.62534,304.17,19 de agosto,"Burning You, Krstenica, Gorenje You, Channel, 5213, Eslovenia",,,
48h,43.23326,27.59636,304.65,19 de agosto,"Río Devnya, Devnya, Varna, 9160, Bulgaria",,,
48h,45.43724,8.79192,304.83,19 de agosto,"Via San Cassiano, Exxon Mobil/Totalarg Sarpom Refinery, Trecate, Novara, Piedmont, 28065, Italia",,,
48h,45.43428,8.7924,302.43,19 de agosto,"Via San Cassiano, Exxon Mobil/Totalarg Sarpom Refinery, Trecate, Novara, Piedmont, 28065, Italia",,,
48h,44.07968,22.10585,303.85,19 de agosto,"Milana Vasića Pericia, Distrito Administrativo Central de Bori Bor, Stari Centari, Bor, Bor, Bor, Bor y Borping, Serbia Central, 19210, Serbia",,,
48h,44.06901,22.13037,301.02,19 de agosto,"393, Ziđin Bor, Oštrelj, Grad Bor, Borski Upravni Okrug, Centralna Srbija, 19210, Serbia",,,
48h,45.14493,9.94127,323.09,19 de agosto,"Viale Guglielmo Marconi, Spinadesco, Cremona, Lombardy, 26028, Italia",,,
48h,44.01283,19.8865,303.97,19 de agosto,"Titan Cementoa Kosjerić, Zivojina Mišića, Galovići, Municipio de Kosjerić, Zlatiborski Prođeni Okrug, Centralna Srbija, 31260, Serbia",,,
48h,41.17731,32.63369,310.97,19 de agosto,"Gerede-Karabük Road, Almuerzo, Lower Kızılcaören, Karabük Center, Karabük, región del Mar Negro, 78100, Turquía",,,
48h,41.17252,32.63126,310.54,19 de agosto,"Gerede-Karabük Road, Almuerzo, Lower Kızılcaören, Karabük Center, Karabük, región del Mar Negro, 78100, Turquía",,,
48h,43.19165,22.2053,327.06,19 de agosto,"17, Jorinska, Kosmovac, municipio de Bela Palanka, Distrito Administrativo de Pirot, Central Serbia, Serbia",,,
48h,43.18839,22.20431,309.1,19 de agosto,"24a, Beske, Cosmovac, municipio de Bela Palanka, Distrito Administrativo de Pirot, Serbia Central, Serbia",,,
48h,41.26795,31.42384,310.28,19 de agosto,"Eregli Demir and Steel Factories, Müftü Mahallesi, Ereğli, Zonguldak, región del Mar Negro, 67320, Turquía",,,
48h,41.26174,31.42834,303.98,19 de agosto,"Eregli Demir and Steel Factories, Müftü Mahallesi, Ereğli, Zonguldak, región del Mar Negro, 67320, Turquía",,,
48h,42.3704,26.27213,301.04,19 de agosto,"Monte, Tundzha, Yambol, Bulgaria",,,
48h,42.36102,26.28062,302.38,19 de agosto,"Savino, Tundzha, Yambol, Bulgaria",,,
48h,42.71922,24.16142,311.09,19 de agosto,"Aurubis Bulgaria, Pirdop, Sofía, 2070, Bulgaria",,,
48h,42.71412,24.17015,327.1,19 de agosto,"Aurubis Bulgaria, Pirdop, Sofía, 2070, Bulgaria",,,
48h,42.38892,24.56953,307.4,19 de agosto,"606, Saedinenie, Plovdiv, Bulgaria",,,
48h,42.38554,24.56839,305.83,19 de agosto,"606, Saedinenie, Plovdiv, Bulgaria",,,
48h,40.75607,31.7809,304.38,19 de agosto,"14-02, Lower, çatakören, Bolu Center, Bolu, Región del Mar Negro, Turquía",,,
48h,40.75877,31.78246,304.58,19 de agosto,"Tarakçı, Centro Bolu, Bolu, Región del Mar Negro, Türkiye",,,
48h,43.52616,12.97944,306.74,19 de agosto,"Rotiglio, Arcevia, Ancona, Marche, 60011, Italia",,,
48h,42.64334,20.89617,298.33,19 de agosto,"Mehmet Gradica, Feronikeli Neighborhood, Municipity of Drenas / Opština Glogovac, 13000, Kosovo / Kosovo",,,
48h,43.52871,12.97893,305.73,19 de agosto,"Rotiglio, Arcevia, Ancona, Marche, 60011, Italia",,,
48h,42.2043,21.74763,313.89,19 de agosto,"Cinco, Municipio de Kumanovo, Noreste de SR, Macedonia del Norte",,,
48h,43.44313,4.88758,304.24,19 de agosto,"ArcelorMittal fos-sur-mer, fos-sur-mer, istres, bouches-du-rhône, Provence-Alpes-Côte d'Azur, Metropolitan France, 13270, Francia",,,
48h,42.08091,21.6429,318.35,19 de agosto,"Umin Dol, Municipio de Kumanovo, Noreste de SR, Macedonia del Norte",,,
48h,43.44006,4.8757,306.75,19 de agosto,"ArcelorMittal fos-sur-mer, fos-sur-mer, istres, bouches-du-rhône, Provence-Alpes-Côte d'Azur, Metropolitan France, 13270, Francia",,,
48h,43.43999,4.88369,301.92,19 de agosto,"ArcelorMittal fos-sur-mer, fos-sur-mer, istres, bouches-du-rhône, Provence-Alpes-Côte d'Azur, Metropolitan France, 13270, Francia",,,
48h,43.43324,4.89159,305.48,19 de agosto,"Ruta 5, ArcelorMittal Fos-sur-Mer, Fos-sur-Mer, Istres, Bouches-du-Rhône, Provence-Alpes-Côte d'Azur, Francia Metropolitana, 13270, Francia",,,
48h,39.83726,30.29922,303.99,19 de agosto,"Çimsa cement fábrica, vecindario HISAR, Tepebaşı, Eskişehir, región central de Anatolia, Turquía",,,
48h,41.44482,21.93931,331.5,19 de agosto,"Shivov, Municipio de Kavadarci, Vardarski SR, Macedonia del Norte",,,
48h,40.44464,27.14125,308.15,19 de agosto,"Içdaş, Değirmencik, BigA, çanakkale, región de Mármara, Türkiye",,,
48h,41.34458,21.35014,301.84,19 de agosto,"Krivogashtani, Municipio de Krivogashtani, Pelagonija Sr, 7524, Macedonia del Norte",,,
48h,39.5784,29.8621,303.55,19 de agosto,"Seyitömer Mound, 43-79, ̇shak Seydi, Kütahya Center, Kütahya, región del Egeo, Turquía",,,
48h,39.05021,31.88148,300.4,19 de agosto,"Vecindario Gökpınar, çeltik, Konya, región central de Anatolia, Türkiye",,,
48h,41.50151,19.74283,305.41,19 de agosto,"Fushe Kruja, Fushe-Kruja, Municipio de Kruja, Distrito de Durres, Northern Albania, 1502, Albania",,,
48h,38.34589,33.18152,300.29,19 de agosto,"Kemer Plateau, Altınekin, Konya, región central de Anatolia, Türkiye",,,
48h,41.72608,15.05752,302.81,19 de agosto,"Provincial Road 166 Ex SS Maglianese, Torremaggiore, Foggia, Puglia, Italia",,,
48h,41.72355,15.05742,301.63,19 de agosto,"Provincial Road 166 Ex SS Maglianese, Torremaggiore, Foggia, Puglia, Italia",,,
48h,38.34673,33.18484,299.44,19 de agosto,"Kemer Plateau, Altınekin, Konya, región central de Anatolia, Türkiye",,,
48h,39.86813,26.24322,304.27,19 de agosto,"Mahmudiye, Ezine, çanakkale, región de Mármara, Türkiye",,,
48h,39.86441,26.24187,307.29,19 de agosto,"Mahmudiye, Ezine, çanakkale, región de Mármara, Türkiye",,,
48h,41.35185,15.90825,303.94,19 de agosto,"Cerignola, Foggia, Puglia, Italia",,,
48h,38.65873,30.61686,304.66,19 de agosto,"Centro Afyonkarahisar, Afyonkarahisar, región del Egeo, Türkiye",,,
48h,39.09335,27.5113,307.05,19 de agosto,"Eynez Road, Arpaseki Neighborhood, Soma, Manisa, región del Egeo, 35990, Turquía",,,
48h,40.91108,16.17487,304.63,19 de agosto,"Genzano di Lucania, Potenza, Basilicata, 76014, Italia",,,
48h,40.63011,18.00021,312.72,19 de agosto,"Road for Pandi, Brindisi, Puglia, Italia",,,
48h,40.84156,16.10572,312.42,19 de agosto,"Genzano di Lucania, Potenza, Basilicata, Italia",,,
48h,38.1526,30.84869,303.74,19 de agosto,"Aziz Paul Road, Kemer, Gelendost, Isparta, región mediterránea, Turquía",,,
48h,40.73084,16.73487,304.45,19 de agosto,"Road municipal al aire libre Fontana Rossa, Masserie Marcantonio, Santeramo en Colle, Bari, Puglia, Italia",,,
48h,40.51973,17.20542,309.82,19 de agosto,"AM - Calle 12, Acciaierie D'Italia S.P.A., Taranto, Puglia, 74123, Italia",,,
48h,40.51906,17.21069,309.74,19 de agosto,"Taranto, Puglia, 74123, Italia",,,
48h,40.50845,17.20836,315.95,19 de agosto,"Am - Street 1, Acciaierie D'Italia S.P.A., Taranto, Puglia, 74123, Italia",,,
48h,40.5036,17.2181,311.55,19 de agosto,"Am - Street 4, Steel Mills of Italy S.P.A., Taranto, Puglia, 74123, Italia",,,
48h,40.50138,17.20684,305.74,19 de agosto,"Am - Street 3, Acciaierie D'Italia S.P.A., Taranto, Puglia, 74123, Italia",,,
48h,40.39973,17.80677,309.54,19 de agosto,"SS 7ter - South Soft, San Pancrazio Salentino, Brindisi, Puglia, 72026, Italia",,,
48h,38.75444,26.95061,323.41,19 de agosto,"Bozköy Neighborhood, Aliağa, Esmir, región del Egeo, 35800, Türkiye",,,
48h,38.74659,26.94773,308.26,19 de agosto,"Refriamiento de borradores mecánicos, Industry Street, Cumhuriyet Mahallesi, Bozköy Neighborhood, Aliağa, Región Egeo, 35687, Turquía",,,
48h,38.73399,26.966919999999998,310.29,19 de agosto,"Industry Street, Cumhuriyet Mahallesi, Horozgediği Mahallesi, Aliağa, región del Egeo, 35687, Turquía",,,
48h,40.23547,18.09913,304.15,19 de agosto,"Copertino, Lecce, Puglia, 73043, Italia",,,
48h,39.35528,22.98347,312.88,19 de agosto,"Volos - Neochori, Aget Heraklis, Agria, Municipio de Volos, Unidad Regional de Magnesia, Región de Tesalia, Administración descentralizada de Tesalia - Grecia Central, 382 22, Grecia",,,
48h,40.31622,15.89248,298.51,19 de agosto,"Viggiano, Potenza, Basilicata, 85057, Italia",,,
48h,38.42726,27.21862,308.1,19 de agosto,"Çimentaş Esgro de cemento Fábrica, Işıklar Mahallesi, Bornova, región del Egeo, 35080, Turquía",,,
48h,39.84754,18.35769,306.03,19 de agosto,"Arigliano, Gagliano del Capo, Lecce, Puglia, 73034, Italia",,,
48h,39.8469,18.36246,311.67,19 de agosto,"Arigliano, Gagliano del Capo, Lecce, Puglia, 73034, Italia",,,
48h,37.25332,30.44238,313.01,19 de agosto,"ASçim Cement Factory, Döşemealtı, Bucak, Burdur, región mediterránea, Turquía",,,
48h,39.17952,20.89478,307.13,19 de agosto,"Philippiada, Municipio de Ziros, Unidad Regional de Preveza, Región de Epirus, Administración descentralizada de Epirus - Macedonia occidental, 482 00, Grecia",,,
48h,39.17881,20.89919,305.12,19 de agosto,"ArtA, Municipio de Artea, Unidad Regional de Arta, Región de Epirus, Administración descentralizada de Epirus - Macedonia occidental, 471 00, Grecia",,,
48h,38.7951,15.20582,324.53,19 de agosto,"Sciara del Fuoco, Stromboli Volcano Trail, Lipari, Messina, Sicilia, Italia",,,
48h,38.79427,15.21317,326.68,19 de agosto,"Stromboli Volcano Trail, Lipari, Messina, Sicilia, Italia",,,
48h,38.20414,15.26739,308.96,19 de agosto,"Strada B, Refinería de Milazzo, Parco, Milazzo, Messina, Sicilia, 98057, Italia",,,
48h,38.12914,15.75465,308.87,19 de agosto,"Santa Domenica, Reggio Di Calabria, Reggio Calabria, Calabria, 89126, Italia",,,
48h,37.75083,14.99478,314.78,19 de agosto,"Cráteres centrales, Zafferana etnea, Catania, Sicilia, 95019, Italia",,,
48h,37.74648,14.9992,318.53,19 de agosto,"Cráteres centrales, Zafferana etnea, Catania, Sicilia, 95019, Italia",,,
48h,37.74276,14.99809,300.61,19 de agosto,"Central Craters, Belpasso, Catania, Sicilia, 95032, Italia",,,
48h,37.73907,14.99687,301.94,19 de agosto,"Central Craters, Belpasso, Catania, Sicilia, 95032, Italia",,,
48h,37.73537,14.99557,308.71,19 de agosto,"Central Craters, Belpasso, Catania, Sicilia, 95032, Italia",,,
48h,37.93637,12.73941,306.58,19 de agosto,"Borgo Binuara, Trapani, Sicilia, 91100, Italia",,,
48h,37.93211,12.73869,318.52,19 de agosto,"Via Domingo, Borgo Livio Bassi, Ummari, Trapani, Sicilia, 91100, Italia",,,
48h,37.93106,12.65578,307.71,19 de agosto,"Fulgator-Torretta, Trapani, Sicilia, 91100, Italia",,,
48h,37.91791,12.75235,326.92,19 de agosto,"Strada Chinea, Trapani, Sicilia, 91100, Italia",,,
48h,37.9268,12.65497,311.35,19 de agosto,"Road Provincial 29 Trapani - Salemi, Trapani, Sicilia, 91100, Italia",,,
48h,37.54844,14.2807,300.02,19 de agosto,"Strada Vicinale Mugavero, Espíritu Santo, Enna Bassa, Enna, Sicilia, 94100, Italia",,,
48h,37.25642,15.05041,307.33,19 de agosto,"Road provincial Priolo Gargallo-Lenini, Villasmundo, Melilli, Syracuse, Sicilia, 96010, Italia",,,
48h,37.21262,15.16701,307.6,19 de agosto,"Provincial Road Rasiom-Innesto SP96, Melilli, Syracuse, Sicilia, 96010, Italia",,,
48h,37.39334,13.46633,302.65,19 de agosto,"Provincial Road 29-B, Agrigento, Sicilia, 92100, Italia",,,
48h,37.2919,14.33351,329.08,19 de agosto,"Passo delle lasaña, Mazzarino, Caltanissetta, Sicilia, 93013, Italia",,,
48h,37.29123,14.3395,322.89,19 de agosto,"Casas San Cono Sottano, Mazzarino, Caltanissetta, Sicilia, 93013, Italia",,,
48h,36.86861,6.97725,328.57,19 de agosto,"Voie Rapide Skikda-Laarbi Ben Mhidi, Allaua Taghane, Skikda ⵙⴽⵉⴽⴷⴰ Skikda, Daïra Skikda, Skikda, 21039, Algérie",,,
48h,36.86403,6.95095,325.81,19 de agosto,"Zona industrial petroquímica de Sonatrach, Skikda ⵙⴽⵉⴽⴷⴰ سكيكدة, Daïra Skikda, Skikda, Argelia",,,
48h,36.76466,7.30674,307.02,19 de agosto,"RN 44, Hadjar Essoud, Bekkouche Lakhdar ⴱⴻⴽⴽⵓⵛ ⵍⴻⵅⴹⴻⵔ Green Crus",,,
48h,36.74826,6.25252,317.3,19 de agosto,"CW 38, Mechta Beni Zebbane, El Milia ⵍⵎ⵵⵵ⴰ الميلية, Daïra El Milia, Jijel, 18001, Argelia",,,
48h,36.74677,6.2476,303.54,19 de agosto,"La zona industrial de Bellara, Mechta Beni Zebbane, El Milia ⵵⵵⵵⵵ ൢ ⴰ ⴰ المي St, Daïra El Bilia, Jijel, 1830",,,
48h,36.74651,6.25314,317.49,19 de agosto,"CW 38, Mechta Beni Zebbane, El Milia ⵍⵎ⵵⵵ⴰ الميلية, Daïra El Milia, Jijel, 18001, Argelia",,,
48h,36.54476,4.96163,322.81,19 de agosto,"Taarkout, Barbacha, Daïra Barbacha, Béjaïa, 06009, Argelia",,,
48h,36.43074,6.62165,305.68,19 de agosto,"Hamma Bouziane Djaouad Tahar Cementery (Schb), RN 3, Hamma Bouziane ⵃⴰⵎⴰ حامة بوزيان, Daïra Hamma Bouziane, Constantine, 25024, Algeria",,,
48h,36.43281,6.62092,311.81,19 de agosto,"Hamma Bouziane Djaouad Tahar Cementery (Schb), RN 3, Hamma Bouziane ⵃⴰⵎⴰ حامة بوزيان, Daïra Hamma Bouziane, Constantine, 25024, Algeria",,,
48h,36.34905,4.5759,305.69,19 de agosto,"Tiwririn, Aït R'zine, Daïra Ighil Ali, Béjaïa, 06013, Argelia",,,
48h,36.08525,6.80286,310.3,19 de agosto,"Grupo industrial de cementos de Argelia - Gica, Sigus ⵙⵉⴳⵓⵙ سيقوس, Daïra Sigus, Oum El Bouaghi, Argelia",,,
48h,35.87986,4.44131,304.57,19 de agosto,"Hammam Delaa ⵃⴻⵎⵎⴰⵎ ⴹⴹⴰⵍⵄⴰ حمام الضلعة, Daïra Hammam Delaa, M'Sila, 28005, Argelia",,,
48h,35.55177,6.86466,306.4,19 de agosto,"CW 10, Remila Me ⵉⴰ الرميلة, Daïra Kaïs, Khenchela, Argelia",,,
48h,35.55162,6.86378,299.79,19 de agosto,"CW 10, Remila Me ⵉⴰ الرميلة, Daïra Kaïs, Khenchela, Argelia",,,
48h,35.23532,8.17227,307.27,19 de agosto,"El My Labiodh ⵍⵎⴰ ا الماء اابيض, Daïra El Ma Labiodh, Tébessa, 12014, Argelia",,,
48h,35.34828,5.75906,326.63,19 de agosto,"RN 28, The Société des Ciments de Ain-Touta Scimat, Legridet, Tilatou ⵜⵉⵍⴰⵜⵓ omin.",,,
48h,34.50599,6.97887,305.53,19 de agosto,"Labreg Power Plant, Babar ⴱⴰⴱⴰⵔ بابار, Daïra Babar, Khenchela, Argelia",,,
48h,58.61491,31.23363,305.45,19 de agosto,"Vyazhishishchi Viajes, Distrito de la Ciudad de Veliky Novgorod, Región de Novgorod, Distrito Federal del Noroeste, 173507, Rusia",,,
48h,63.31715,9.13964,305.08,19 de agosto,"482, Hollaveien, Holla Smitter, Holla, Kyrksæterøra, Heim, Trøndelag, 7200, Noruega",,,
48h,60.81178,5.03004,300.44,19 de agosto,"Mongstad, Mongstad Production Facility, Alver, Vestland, 5954, Noruega",,,
48h,61.20727,1.83287,298.92,19 de agosto,Statfjord b,,,
48h,61.24172,1.14892,300.17,19 de agosto,#VALUE!,,,
48h,61.10226,1.06833,301.93,19 de agosto,#VALUE!,,,
48h,60.81226,1.73008,306.05,19 de agosto,North Alwyn B,,,
48h,54.56199,25.12549,304.18,19 de agosto,"7, Taržėnai, Andership Pagiriai, Municipio del Distrito de Vilnius, Condado de Vilnius, 14120, Lituania, Lituania",,,
48h,54.55869,25.13365,298.57,19 de agosto,"Nightingali St., Targiriai, Ancianos de Pagiriai, Municipio del Distrito de Vilnius, Condado de Vilnius, 14120, Lituania, Lituania",,,
48h,59.64838,6.36033,299.43,19 de agosto,"Birkelandsvegen, Lofthus, Sauda, ​​Rogaland, 4200, Noruega",,,
48h,59.54836,1.53376,303.63,19 de agosto,#VALUE!,,,
48h,59.54506,1.53202,328.02,19 de agosto,#VALUE!,,,
48h,59.28131,1.51369,304.14,19 de agosto,#VALUE!,,,
48h,52.5779,18.22557,299.32,19 de agosto,"25, Glinki, Wronowy, Strzelno Commune, Mogileński Poviat, Kuyavian-Pomeranian Voivodeship, 88-320, Polonia",,,
48h,50.93111,21.67457,300.99,19 de agosto,"79, Karsy, Ożarów Commune, Opatów Poviat, Świętokrzyskie Voivodeship, Polonia",,,
48h,51.54444,19.81744,314.12,19 de agosto,"Ewcin, comuna de Będków, Tomaszów Poviat, łódź Voivodeship, Polonia",,,
48h,50.80817,20.531,298.74,19 de agosto,"Zakładowa, Wola Murowana, Nowiny Commune, Kielce Poviat, Świętokrzyskie Voivodeship, 26-052, Polonia",,,
48h,51.10356,18.94173,296.63,19 de agosto,"Cementownia Warta S.A., Emergency Estate, Grądy, Działoszyn Commune, Pajęczański Poviat, łódź Voivodeship, 98-355, Polonia",,,
48h,52.49055,13.84095,298.67,19 de agosto,"Strausberger Straße, Herzfelde, Rüdersdorf cerca de Berlín, Märkisch-Oderland, Brandenburg, 15378, Alemania",,,
48h,52.1711,14.64208,298.67,19 de agosto,"Progrup Parkplatz, Oderlandstraße, ArcelorMittal, Eisenhüttenstadt, Oder-Spree, Brandenburg, 15890, Alemania",,,
48h,52.17431,14.612120000000001,311.99,19 de agosto,"Straße 70, ArcelorMittal, Eisenhüttenstadt, Oder-Spree, Brandenburg, 15890, Alemania",,,
48h,52.1704,14.6253,306.8,19 de agosto,"Straße 20, ArcelorMittal, Schönfließ, Eisenhüttenstadt, Oder-Spree, Brandenburg, 15890, Alemania",,,
48h,52.1684,14.61288,301.44,19 de agosto,"Straße 62, ArcelorMittal, Eisenhüttenstadt, Oder-Spree, Brandenburg, 15890, Alemania",,,
48h,51.68943,15.97808,315.16,19 de agosto,"Huta Miedzi ""Głogów"", 292, Kłoda, żukowice Commune, Głogów Poviat, Dolnośląskie Voivodeship, 67-232, Polonia",,,
48h,51.68784,15.98308,301.44,19 de agosto,"Huta Miedzi ""Głogów"", 292, Kłoda, żukowice Commune, Głogów Poviat, Dolnośląskie Voivodeship, 67-232, Polonia",,,
48h,51.68615,15.98039,313.7,19 de agosto,"Huta Miedzi ""Głogów"", 292, Kłoda, żukowice Commune, Głogów Poviat, Dolnośląskie Voivodeship, 67-232, Polonia",,,
48h,53.36498,8.69354,305.11,19 de agosto,"Eilandstraße, Bramstedt, Hagen en los Bremen, Distrito de Cuxhaven, Lower Sajonia, 27628, Alemania",,,
48h,50.33724,18.82891,296.28,19 de agosto,"Ziemska, Osiedle Młodyj Górnik, Zabrze, Górnośląsko-zagłębie Metropolia, 41-803, Polonia",,,
48h,50.33474,18.83596,300.74,19 de agosto,"Ziemska, Biskupice, Zabrze, Górnośląsko-zagłębie Metropolia, 41-803, Polonia",,,
48h,51.1814,16.11077,330.48,19 de agosto,"Złotoryjska, Legnica, Dolnośląskie Voivodeship, 59-220, Polonia",,,
48h,51.1797,16.11607,308.57,19 de agosto,"Złotoryjska, Legnica, Dolnośląskie Voivodeship, 59-220, Polonia",,,
48h,51.17638,16.10686,321.98,19 de agosto,"Smokowicka, Smokowice, Legnica, Dolnośląskie Voivodeship, 59-220, Polonia",,,
48h,51.17464,16.11225,304.33,19 de agosto,"4, Myśliwska, Czerniewice, Legnica, Czerniewice, Dolnośląskie Voivodeship, 59-220, Polonia",,,
48h,51.18087,16.11263,367,19 de agosto,"Złotoryjska, Legnica, Dolnośląskie Voivodeship, 59-220, Polonia",,,
48h,51.17585,16.10873,308.97,19 de agosto,"5, Myśliwska, Czerniewice, Legnica, Czerniewice, Dolnośląskie Voivodeship, 59-220, Polonia",,,
