tipo,latitude,longitude,bright,date,admin2,admin3,country_code,country_es
48h,36.59484,2.87919,309.55,19 de agosto,"CW 109, Behamalni, Benhahlim ⁄⁄Se ⁄4 ⁄2⁄20% del Penisé Kilosés Kilo Vignansé, Dalara y 99 Obal, Daira Leona, Dala, Coulision, Beau y Balai Best",,,
48h,36.47559,2.75057,313.92,19 de agosto,"Ahl el Uedini, Chiffa ⁄⁄2⁄2000 en la República de Molazing, Daira Mozarari, Blidaa, 0902, 0902 y Geïn.",,,
48h,35.87819,4.446,329.07,19 de agosto,"RN 60, Hammam Delaa ⵃⴻⵎⵎⴰⵎ ⴹⴹⴰⵍⵄⴰ ⴹⴹⴰⵍⵄⴰ حمام الضلعة, Daïra Hammam Delaa, M'Sila, 28005, Argelia",,,
48h,35.71107,4.47553,311.9,19 de agosto,"CW 1, he terminado ⵝⴰ ⵉ⵵ ⵉ⵵ المسي.",,,
48h,37.66752,-5.1645,303.99,19 de agosto,"Malpica, Écija, Sevilla, Andalucía, España",,,
48h,35.09625,5.64633,311.37,19 de agosto,"CW 54A, Djemorah ⴵⵎⵓⵔⴰ جمورة, Daïra Djemorah, Biskra, Argelia",,,
48h,36.13014,1.24149,310.48,19 de agosto,"Zone Industrielle Oued Sly-Chlef, Oued Sly ⵡⴰⴷ و وادي سلي, Daïra Boukadir, Chlef, 02011, Argelia",,,
48h,36.12605,1.24011,304.66,19 de agosto,"RN 4, Caber, Ouli Ro Liply ⁄lish Pé Descarga que es el afeitado del cisne, Dakara Boukad, Che Per, chec",,,
48h,36.12877,1.2431,310.8,19 de agosto,"Zone Industrielle Oued Sly-Chlef, Caper, Oued Sly ⵡⴰⴷ وادي سلي, Daïra Boukadir, Chlef, 02011, Argelia",,,
48h,37.33468,-6.59241,308.39,19 de agosto,"Bordallo, Rociana del Condado, El Condado, Huelva, Andalucía, 21720, España",,,
48h,36.71443,-4.33073,310.64,19 de agosto,"Cementera de Málaga, Autovía de Acceso Este a Málaga, Este, Málaga, Málaga-Costa del Sol, Málaga, Andalucía, 29720, España",,,
48h,35.8159,-0.27121,310.97,19 de agosto,"Bethioua ⴱⴻⵟⵟⵉⵡⴰ بطيوة, Daïra Bethioua, Oran, Argelia",,,
48h,35.80845,-0.23533,316.19,19 de agosto,"RN 11, Dar Ben Messoussa, Houahoua, Bethioua ⴱⴻⵟⵟⵉⵡⴰ بطيوة, Daïra Bethioua, Oran, 27020, Argelia",,,
48h,35.80836,-0.25456,343.07,19 de agosto,"CW 5A, Bethioua ⴱⴻⵟⵟⵉⵡⴰ Bataya, Daïra Bethioua, Oran, Algérie",,,
48h,35.8121,-0.27254,318.72,19 de agosto,"El Arrasa, Bethioua ⴱⴻⵟⵟⵉⵡⴰ بطيوة, Daïra Bethioua, Oran, 31200, Argelia",,,
48h,35.6419,-0.47912,309.24,19 de agosto,"Sidimi ⁄в ′ es el ⁄⁄2ille de los segundos cables de Kalaka, Dala SEGOU",,,
48h,35.53374,-0.27324,305.62,19 de agosto,"Cimenterie du Gis (CIBA), RN 4, Oggaz ⵄⵓⴳⴳⴰⵔ عقاز, Daïra Oggaz, Mascara, Argelia",,,
48h,35.46029,-0.39342,314.24,19 de agosto,"CW 98, Djeeene El Esskine, Jasïn ‵ ⁄2 ′ Ja ⁄2 y ، Dasnai, Dascana, Dasala, la ciudad de Malí",,,
48h,35.56587,-0.93707,305.28,19 de agosto,"CW 20, Haï Emmanris, Bouwletle ⁄2⁄2⁄2 'y Seigliis Allahitire Gill Nuestro Worsbout, Suidening Conmet, Sanke, Suidentyare",,,
48h,35.31171,-1.3444,307.31,19 de agosto,"The Creetie Bla Saf, Ouled Bood Body, Ben's ′ F ⁄2⁄2⁄2⁄2000 ⁄2 taza de 2016, Daïlen Kumi",,,
48h,53.57169,-0.60333,298.03,19 de agosto,"The Subway, British Steel Ltd (Scunthorpe Steelworks), Scunthorpe, North Lincolnshire, Inglaterra, DN16 1XA, Reino Unido",,,
48h,53.56828,-0.59497,304.78,19 de agosto,"Concast Road, British Steel Ltd (Scunthorpe Steelworks), Broughton, North Lincolnshire, Inglaterra, DN16 1XA, Reino Unido",,,
48h,53.56815,-0.60241,300.33,19 de agosto,"Bos Oprowing Road, British Steel Ltd (Scunthorpe Steelworks), New Brumby, Scunthorpe, North Lincolnshire, Inglaterra, DN16 1AW, Reino Unido",,,
48h,65.56071,22.23072,328.5,19 de agosto,"Östra Ringleden, Svartöstan, Luleå, Luleå Kommun, Norrbottens West, 974 38, Sverige",,,
48h,38.05352,34.93519,342.16,19 de agosto,"Yarhisar, Niğde, Central Anatolia, Türkiye",,,
48h,37.75771,31.82239,353.39,19 de agosto,"Migración, Konya, región central de Anatolia, Türkiye",,,
48h,37.48029,30.07934,347.63,19 de agosto,"Burdur Center, Burdur, región mediterránea, Türkiye",,,
48h,38.27838,30.87268,343.38,19 de agosto,"Afyon-Antalya Road, Gökçeali, Yalvaç, Isparta, región mediterránea, Turquía",,,
48h,39.50599,33.64502,355.15,19 de agosto,"Akkaş, Keskin, Kırıkkale, región central de Anatolia, Türkiye",,,
48h,39.17596,31.07139,342.39,19 de agosto,"Koyunlu, Baglu, Emirdag, Afyonkarahisar, región del Egeo, 38000, Turquía",,,
48h,40.92158,26.06679,367,19 de agosto,"Egnatia Odos, municipio de Alexandroupolis, Unidad Regional de Evros, Región de Macedonia Oriental y Tracia, Administración descentralizada de Macedonia - Tracia, Grecia",,,
48h,40.92629,26.08305,348.8,19 de agosto,"Municipio de Alexandroupolis, Unidad Regional de Evros, Región de Macedonia Oriental y Tracia, Administración descentralizada de Macedonia - Tracia, Grecia",,,
48h,40.92863,26.06927,367,19 de agosto,"Melia, Municipio de Alexandroupolis, Unidad Regional de Evros, región de Macedonia y Tracia del este, Administración descentralizada de Macedonia - Tracia, 685 00, Grecia",,,
48h,43.7625,28.57746,338.36,19 de agosto,"DN39, Vama Veche, Limanu, Constanța, 907163, Rumania",,,
48h,45.85711,34.54348,354.84,19 de agosto,"Asentamiento rural de Medvedevsky, distrito de Dzhankoy, Ucrania",,,
48h,46.08638,33.48393,340.16,19 de agosto,"Comunidad de Kalanchatska, Distrito de Skadovsky, región de Kherson, Ucrania",,,
48h,43.78563,24.09258,339.09,19 de agosto,"Danube Street, Dăbuleni, Dolj, 207220, Rumania",,,
48h,43.78454,24.0927,348.17,19 de agosto,"DC39, Dăbuleni, Dolj, 207220, Rumania",,,
48h,46.35352,34.3923,340,19 de agosto,"Novotroitsk Settlement Community, Genichesky District, región de Kherson, Ucrania",,,
48h,43.7821,23.63678,336.43,19 de agosto,"11, Upper Cibar, Vulchedrum, Montana, Bulgaria",,,
48h,46.43584,34.20487,336.46,19 de agosto,"Voskresenskoe, Novotroitsk Settlement Community, Genichesky District, región de Kherson, 75322, Ucrania",,,
48h,45.5952,29.50983,330.68,19 de agosto,"El antiguo distrito antiguo, la comunidad de la ciudad de Vilkivska, el distrito de Izmail, la región de Odesa, Ucrania",,,
48h,46.5181,33.74582,336.43,19 de agosto,"Cross Rural Community, Distrito de Kakhovsky, región de Kherson, Ucrania",,,
48h,46.45961,32.99019,336.19,19 de agosto,"Dobrosillya, Velikopanivska Comunidad rural, Distrito de Kherson, región de Kherson, 75132, Ucrania",,,
48h,46.6771,33.88434,334.99,19 de agosto,"Comunidad de la aldea de Zelenopyska, distrito de Kakhovsky, región de Kherson, Ucrania",,,
48h,46.69426,33.93352,333.01,19 de agosto,"O221220, Comunidad de Tavrichan Village, Distrito de Kakhovsky, región de Kherson, 74850, Ucrania",,,
48h,46.53936,32.96774,336.68,19 de agosto,"Oleshkiv City Community, Distrito de Kherson, región de Kherson, Ucrania",,,
48h,46.97005,34.6988,341.52,19 de agosto,"Comunidad de la aldea de Chkalovskaya, distrito de Melitopol, región de Zaporizhzhya, Ucrania",,,
48h,46.61496,32.81153,335.7,19 de agosto,"M-14, Oleshkiv City Community, Distrito de Kherson, región de Kherson, Ucrania",,,
48h,46.73021,33.28411,337.07,19 de agosto,"Paradise, Novokakhovsk City Community, Distrito de Kakhovsky, región de Kherson, 74991, Ucrania",,,
48h,46.67054,32.93023,352.16,19 de agosto,"Podstepne, Oleshkiv City Community, Distrito de Kherson, región de Kherson, 75112, Ucrania",,,
48h,46.57613,32.43217,334.19,19 de agosto,"S.Narne, Amber, Belozersk Settlement Community, Distrito de Kherson, región de Kherson, 75003, Ucrania",,,
48h,46.58712,32.42742,336.39,19 de agosto,"O220201, Romashkovo, Giant, Belozersk Settlement Community, Distrito de Kherson, región de Kherson, 75003, Ucrania",,,
48h,45.78162,28.8204,332.18,19 de agosto,"Comunidad de la aldea de Kuba, distrito de Bolgrad, región de Odesa, Ucrania",,,
48h,47.09676,34.99356,338.42,19 de agosto,"Comunidad de asentamientos de Mikhailovsky, distrito de Vasylivsky, región de Zaporizhzhya, Ucrania",,,
48h,46.69674,32.90541,346.12,19 de agosto,"Kudasovo, Oleshkiv City Community, Distrito de Kherson, región de Kherson, 75112, Ucrania",,,
48h,47.0234,34.52765,345.36,19 de agosto,"O221313, Nizhnohgorod Settlement Community, Distrito de Genichesky, región de Kherson, 74712, Ucrania",,,
48h,46.79036,33.25774,336.58,19 de agosto,"Mykolaivka, Comunidad de Tyagyn Village, distrito de Beryslav, región de Kherson, 74342, Ucrania",,,
48h,46.68816,32.37532,353.17,19 de agosto,"Zoryivka, Belozersk Settlement Community, Distrito de Kherson, región de Kherson, 75015, Ucrania",,,
48h,46.69316,32.38018,342.62,19 de agosto,"Comunidad de asentamiento de Belozersk, distrito de Kherson, región de Kherson, Ucrania",,,
48h,46.69682,32.37857,335.33,19 de agosto,"C220206, Nadezhivka, Belozersk Settlement Community, Distrito de Kherson, región de Kherson, 75015, Ucrania",,,
48h,47.13819,34.43171,367,19 de agosto,"Comunidad de asentamientos de Verkhnorogachytska, distrito de Kakhovsky, región de Kherson, Ucrania",,,
48h,46.76263,32.42648,339.18,19 de agosto,"O220203, Comunidad Rural de Chernobayivska, Distrito de Kherson, región de Kherson, 75022, Ucrania",,,
48h,46.0441,29.02817,349.42,19 de agosto,"Comunidad de asentamiento de Tarutyn, distrito de Bolgrad, región de Odesa, Ucrania",,,
48h,46.05257,29.02392,336.69,19 de agosto,"El primero, la comunidad de asentamientos de Tarutinsky, distrito de Bolgrad, región de ODESA, 68554, Ucrania",,,
48h,47.35248,34.96844,339.9,19 de agosto,"Comunidad de la aldea de Malobilozersk, distrito de Vasylivskyi, región de Zaporizhzhya, Ucrania",,,
48h,46.61979,30.97023,341.39,19 de agosto,"Comunidad de asentamiento del mar negro, distrito de Odessa, región de Odesa, 67554, Ucrania",,,
48h,46.34657,29.73146,344.75,19 de agosto,"Comunidad de Starokozatsk Village, distrito de Belgorod-Dnestrovsky, región de Odesa, Ucrania",,,
48h,47.25861,33.84071,337.69,19 de agosto,"T-04-03, Dudchans, Novooleksandrivska Rural Community, District Beryslav, región de Kherson, 74231, Ucrania",,,
48h,46.70089,30.86812,337.94,19 de agosto,"Ivanovo, comunidad de la aldea de Krasnosilska, distrito de Odessa, región de Odesa, 67542, Ucrania",,,
48h,47.25777,33.48803,335.28,19 de agosto,"O220401, Trifonivka, Velikoleksandrivska City Community, Distrito de Beryslav, región de Kherson, 74100, Ucrania",,,
48h,47.015,32.16209,340.9,19 de agosto,"Comunidad de asentamientos de Voskresensky, distrito de Mykolaiv, región de Mykolaiv, 57210, Ucrania",,,
48h,47.30955,32.64492,349.86,19 de agosto,"Comunidad de la ciudad de Bashtansk, distrito de Bashtansky, región de Mykolaiv, Ucrania",,,
48h,47.29879,32.50494,333.21,19 de agosto,"O150214, Vidyn, Bashtansk City Community, Distrito de Bashtansky, región de Mykolaiv, 56166, Ucrania",,,
48h,47.80814,34.76058,335.64,19 de agosto,"H-23; O-041907, Comunidad de la Ciudad de Tomakiv, Distrito Nikopol, Región Dnipropetrovsk, Ucrania",,,
48h,47.69191,33.87661,330.54,19 de agosto,"Comunidad de la aldea de Hrushevsk, distrito de Kryvyi Rih, región de Dnipropetrovsk, Ucrania",,,
48h,47.78119,33.9377,337,19 de agosto,"Comunidad de la Ciudad Apostólica, Distrito Kryvyi Rih, Región Dnipropetrovsk, Ucrania",,,
48h,48.06463,34.91491,331.16,19 de agosto,"Comunidad rural de Shirokivska, Distrito de Zaporizhzhya, Región de Zaporizhzhya, Ucrania",,,
48h,47.93148,33.88874,333.55,19 de agosto,"Comunidad rural de Vakulivska, Distrito Kryvyi Rih, Región de Dnipropetrovsk, Ucrania",,,
48h,47.86649,33.43532,332.41,19 de agosto,"Distrito Metalúrgico, Kryvyi Rih, Kryvyi Rih City Community, Distrito Kryvyi Rih, Región Dnipropetrovsk, Ucrania, Ucrania",,,
48h,47.45384,30.05751,348.02,19 de agosto,"Grebenyuki, comunidad de la aldea de Dolinsky, distrito de Podilskyi, región de Odesa, 66811, Ucrania",,,
48h,48.05414,32.44578,334.59,19 de agosto,"Comunidad de asentamientos de Ustinovsk, Distrito de Kropyvnytskyi, región de Kirovohrad, Ucrania",,,
48h,48.32798,33.75047,342.6,19 de agosto,"Comunidad de la aldea de Saksagan, distrito de Kamyansky, región de Dnipropetrovsk, Ucrania",,,
48h,47.69516,30.68013,339,19 de agosto,"Comunidad de asentamientos de Vradiyevsky, distrito de pervomaisco, región de Mykolaiv, Ucrania",,,
48h,44.79608,20.22337,339.23,19 de agosto,"Viena, Municipio de la Ciudad Surčin, ciudad de Belgrado, Central Serbia, Serbia",,,
48h,47.44818,28.49068,331.65,19 de agosto,"Distrito Telenești, Moldavia",,,
48h,47.5653,28.91657,340.24,19 de agosto,"Pohrebeni, distrito de Orhei, Moldavia",,,
48h,48.6143,32.33467,343.66,19 de agosto,"Velikoseverinovsk Village Community, Distrito de Kropyvnytskyi, región de Kirovohrad, 27601, Ucrania",,,
48h,45.47196,20.61206,328.3,19 de agosto,"Torak, municipio de žitište, Srednjobanatski Prođeni Okrug, Vojvodina, 23232, Serbia",,,
48h,49.19826,34.94073,335.72,19 de agosto,"O-1714206, Ryshke, Mikhailovsk Village Community, Región de Poltava, 39453, Ucrania",,,
48h,47.23038,24.99324,329.11,19 de agosto,"DN17, Piastra fântânele, Tiha Bârgăului, Bistrița-năsăud, 427363, Rumania",,,
48h,48.31413,25.67841,335.29,19 de agosto,"Garden Street, Drachntsi, comunidad de la aldea de Mamaivska, distrito de Chernivtsi, región de Chernivtsi, 59353, Ucrania",,,
48h,50.74287,28.42409,355.61,19 de agosto,"Omelivka, Khoroshivska Settlement Community, distrito de Zhytomyr, región de Zhytomyr, 12120, Ucrania",,,
48h,52.62457,34.60339,335.08,19 de agosto,"Acuerdo rural de Bratovsky, distrito de Brasovsky, región de Bryansk, distrito federal central, Rusia",,,
48h,51.41855,27.04874,331.34,19 de agosto,"Comunidad de asentamientos de Rokytnovsky, distrito de Sarnensky, región de Rivne, Ucrania",,,
48h,52.599,32.59657,343.62,19 de agosto,"Logovatoy, Distrito Municipal de Starodubsky, Región de Bryansk, Distrito Federal Central, Rusia",,,
48h,53.06104,34.97428,337.51,19 de agosto,"Asentamiento de la ciudad de Karachevsky, distrito de Karachevsky, región de Bryansk, distrito federal central, Rusia",,,
48h,53.44151,34.41953,328.16,19 de agosto,"Hospital Town, Fokino, Distrito de la Ciudad de Fokino, Región de Bryansk, Distrito Federal Central, 242610, Rusia",,,
48h,53.44474,34.41806,328.44,19 de agosto,"CJSC ""Maltsovsky Portland Cement"", Russians Cattle, Fokino, Distrito de la Ciudad de Fokino, Región de Bryansk, Distrito Federal Central, 242610, Rusia",,,
48h,52.8471,29.99002,338.88,19 de agosto,"Planta Metalúrgica Bielorrusia, H4326, Salanoe, Consejo Rural de Salón, Distrito de Zhlobin, Región de Gomel, 247220, Bielorrusia",,,
48h,51.40535,17.64875,327.69,19 de agosto,"Kolejowa, Zielonka, Międzybórz, Międzybórz Commune, Oleśnicki Poviat, Dolnośląskie Voivodeship, 56-513, Polonia",,,
48h,55.09551,30.42009,332.27,19 de agosto,"Lasasina, Consejo de la aldea de Oktyabrsky, distrito de Vitebsk, región de Vitebsk, 211346, Bielorrusia",,,
48h,65.76279,24.18323,331.54,19 de agosto,"Röytt, Tornio, región de Kemi-Tornio, Oficina del Gobierno Regional de Laponia, Mannia-Finland, 95490, Finlandia / Finlandia",,,
48h,64.13579,11.48358,327.63,19 de agosto,"Dalbygdvegen, Jønnem, Steinkjer, Trøndelag, Noruega",,,
48h,34.27493,7.24456,341.22,19 de agosto,"Ben Joch ⁄2 ⁄2000 ⁄2⁄2 y ⁄2 1 انؼ Leade, Daïa Terbi, Eloror, Eleral",,,
48h,35.1404,10.74667,337.21,19 de agosto,"Sidi Hassan Belhadj, Delegación de Al -Hanasha, Estado de Sfax, 3010, Túnez",,,
48h,37.11305,14.45456,340.36,19 de agosto,"Fuente Apa, Niscemi, Caltanissetta, Sicilia, 93015, Italia",,,
48h,38.64926,27.41125,336.3,19 de agosto,"Mariscal Fevzi çakmak Mah., Yunusemre, Manisa, región del Egeo, 45120, Turquía",,,
48h,37.12527,13.8898,335.77,19 de agosto,"South Western Sicilian State Road, Licata, Agrigento, Sicilia, 92027, Italia",,,
48h,38.64669,27.41178,339.7,19 de agosto,"Yunusemre, Manisa, región del Egeo, 45120, Türkiye",,,
48h,37.34535,14.9432,343.92,19 de agosto,"Masseria petralia, Lentini, Syracuse, Sicilia, 96016, Italia",,,
48h,37.34463,14.9388,348.22,19 de agosto,"Curumella, Lentini, Syracuse, Sicilia, 96016, Italia",,,
48h,37.35338,14.95019,342.61,19 de agosto,"Masseria abandonada, Lentini, Syracuse, Sicilia, 96016, Italia",,,
48h,38.88534,32.1356,346.09,19 de agosto,"Altınöz, Yunak, Konya, Central Anatolia, Türkiye",,,
48h,37.30039,14.50446,335.44,19 de agosto,"SP195, Caltagirone, Catania, Sicilia, 95041, Italia",,,
48h,37.34908,14.45224,337.93,19 de agosto,"Piazza Armerina, Enna, Sicilia, 94015, Italia",,,
48h,37.22178,13.67242,340.25,19 de agosto,"Provincial Road 71-B, Zingarello, Agrigento, Sicilia, 92100, Italia",,,
48h,37.33854,13.97867,345.56,19 de agosto,"State Road of Solfare, Sommatino, Caltanissetta, Sicilia, 93019, Italia",,,
48h,37.44175,14.14751,337.62,19 de agosto,"Pietraperzia, Enna, Sicilia, 94016, Italia",,,
48h,37.35649,13.63315,348.79,19 de agosto,"Road State del Valle de Platani, Favara, Agrigento, Sicilia, 92026, Italia",,,
48h,36.67755,9.92328,337.8,19 de agosto,"Enfriamiento de borrador mecánico, RL583, ternero, Delegación de Al -Maraga, Estado de Manouba, 1142, Túnez",,,
48h,37.43947,13.50058,350.38,19 de agosto,"Corleone State Road Agrigentina, Murata Grotta Village, Sant'angelo Muxaro, Agrigento, Sicilia, 92020, Italia",,,
48h,37.72233,15.16044,342.19,19 de agosto,"Via Giuseppe Zinghirino, Sciara, San Giovanni Montebello, Giarre, Catania, Sicilia, 95014, Italia",,,
48h,37.43786,13.47119,338.4,19 de agosto,"Cattolica Eraclea, Agrigento, Sicilia, 92011, Italia",,,
48h,37.45711,13.51986,337.38,19 de agosto,"Montagna Municipal Road, Murata Grotta Village, Sant'angelo Muxaro, Agrigento, Sicilia, 92020, Italia",,,
48h,37.52257,13.77394,338.58,19 de agosto,"Provincial Road Bivio Serradifalco-Montedoro-Bompensiere-Mussomeli, Sutera, Caltanissetta, Sicilia, 93010, Italia",,,
48h,37.52179,13.76947,347.37,19 de agosto,"Contrada Casalicchio, Sutera, Caltanissetta, Sicilia, 93010, Italia",,,
48h,36.68491,8.97727,344.27,19 de agosto,"Abdel -Jabbar, Delegación de Balata Bouanouan, provincia de Jendouba, Túnez",,,
48h,37.7469,14.41133,336.24,19 de agosto,"Cruzadas, Nicosia, Enna, Sicilia, 94014, Italia",,,
48h,37.74616,14.40695,354.29,19 de agosto,"Via Marcello Capra, Cocate, Nicosia, Enna, Sicilia, 94014, Italia",,,
48h,37.74543,14.40255,337.58,19 de agosto,"Vicolo Quarto Sant'antonino, Nicosia, Enna, Sicilia, 94014, Italia",,,
48h,37.61876,13.63576,337.65,19 de agosto,"San Giovanni Géminis, Agrigento, Sicilia, 92020, Italia",,,
48h,37.61799,13.63141,343.16,19 de agosto,"Via Del Mancuso, San Giovanni Géminis, Agrigento, Sicilia, 92020, Italia",,,
48h,37.85262,14.91143,338.43,19 de agosto,"Gurrida, Etnea Western State Road, Randazzo, Catania, Sicilia, 95034, Italia",,,
48h,38.19689,16.12665,332.48,19 de agosto,"Benestare, Reggio Calabria, Calabria, 89031, Italia",,,
48h,37.69407,12.95922,333.17,19 de agosto,"Montevago, Agrigento, Sicilia, 92010, Italia",,,
48h,38.1054,15.20796,330.17,19 de agosto,"Provincial Road 82 Barcelonese, Case Palano, Crizzina, Castroreale, Messina, Sicilia, 98053, Italia",,,
48h,38.1047,15.20359,336.22,19 de agosto,"Case Palano, Simigliano, Protonotaro, Castroreale, Messina, Sicilia, 98053, Italia",,,
48h,37.68252,12.69142,343.69,19 de agosto,"Mazara del Vallo, Trapani, Sicilia, 91026, Italia",,,
48h,38.12159,15.18097,352.75,19 de agosto,"Rodì, Terme Vigliatore, Rodì Milici, Messina, Sicilia, 98059, Italia",,,
48h,37.77216,12.86286,348.31,19 de agosto,"Santa Ninfa, Trapani, Sicilia, 91029, Italia",,,
48h,37.82397,12.96986,335.74,19 de agosto,"Road Provincial 12 de Busecchio, Gibellina, Trapani, Sicilia, 91024, Italia",,,
48h,37.82913,12.97852,341.67,19 de agosto,"Road State de Gibellina, Monreale, Palermo, Sicilia, Italia",,,
48h,37.80398,12.83779,338.47,19 de agosto,"Sicilian Center Western State Road, Salemi, Trapani, Sicilia, 91018, Italia",,,
48h,37.83137,12.72453,337.53,19 de agosto,"Bagnitelli, Pusillesi, Salemi, Trapani, Sicilia, 91018, Italia",,,
48h,37.82356,12.62179,339.77,19 de agosto,"Contrada Mucho de Sant'ambrogio, Marsala, Trapani, Sicilia, 91025, Italia",,,
48h,37.82265,12.61685,339.19,19 de agosto,"Contrada Mucho de Sant'ambrogio / Contrada Nasco, Marsala, Trapani, Sicilia, 91025, Italia",,,
48h,37.90553,12.99413,344.91,19 de agosto,"Provincial Road 64 Quattrovie, Alcamo, Trapani, Sicilia, 91011, Italia",,,
48h,38.40215,15.97552,334.42,19 de agosto,"Via Giuseppe Garibaldi, Contrada Gabellone, Drosi, Rizziconi, Reggio Calabria, Calabria, 89016, Italia",,,
48h,37.94336,13.02432,356.36,19 de agosto,"Provincial Road 10 de Camporeale, Alcamo, Trapani, Sicilia, 91011, Italia",,,
48h,39.59132,26.95015,367,19 de agosto,"Gürlek Street, Sarıkız, Akçay, Edremit, Balıkesir, Región de Marmara, 10305, Turquía",,,
48h,37.94213,12.68845,336.03,19 de agosto,"Strada Marsala Fulgator, Fulgator, Fulgator-Torretta, Trapani, Sicilia, 91100, Italia",,,
48h,38.55214,16.13394,338.87,19 de agosto,"Dinami, Vibo Valentia, Calabria, 89833, Italia",,,
48h,37.98018,12.65681,337.6,19 de agosto,"Specchia, Erice, Trapani, Sicilia, 91016, Italia",,,
48h,37.98363,12.65572,341.82,19 de agosto,"Via Corallaro, Minietta, Specchia, Napola, Erice, Trapani, Sicilia, 91016, Italia",,,
48h,36.34423,4.60275,349.35,19 de agosto,"Ighil Ali, Daïra Ighil Ali, Béjaïa, 06014, Argelia",,,
48h,38.88061,16.65504,335.65,19 de agosto,"Simeri Crichi, Catanzaro, Calabria, Italia",,,
48h,38.99637,16.86685,336.16,19 de agosto,"Marceusa, Catanzaro, Calabria, Italia",,,
48h,36.57393,4.58083,367,19 de agosto,"Ozellaguen, Daïra Ofri Ouzellaguen, Béjaïa, 06010, Argelia",,,
48h,36.57943,4.57988,345.07,19 de agosto,"Thala Ali, Ilmaten, Chemini, Daïra Chemini, Béjaïa, 06770, Argelia",,,
48h,36.67353,4.53437,354.43,19 de agosto,"Road on Taburt Hebbane, Mḥagga, Idjer, Daïra Bouzguen, Tizi Ouzou, 15036, Argelia",,,
48h,36.67843,4.53109,349.27,19 de agosto,"Camino a Vuruh, Agarsafen, Idjer, Daïra Bouzguen, Tizi Ouzou, 15036, Argelia",,,
48h,40.25587,28.90215,338.91,19 de agosto,"Gumus Street, Dogandoy Mahallesi, Nilufer, Bursa, Región de Marmara, 16960, Turquía",,,
48h,36.59824,4.09414,367,19 de agosto,"Agudu, Avrid G'iɣil, Aɣervaz Alemmas Allic Yusef, Tagmunt Azuz, Aït Mahmoud, Daïra Beni Douala, Tizi Ouzou, 15193, Argelia",,,
48h,36.59945,4.09871,334.37,19 de agosto,"Yemma Mel XXIṛ, Avrid Ameqqʷṛan, Aɣervaz Alemmas Allic Yusef, Tagmunt Azuz, Aït Mahmoud, Daïra Beni Douala, Tizi Ouzou, 15193, Algeria",,,
48h,35.80842,-0.25,367,19 de agosto,"Kahrama, CW 5A, Beethioua ⴱⴻⵟⵟⵉⵡⴰ Bataya, Daïra Beethium, Oran, Algérie",,,
48h,40.79192,29.47467,367,19 de agosto,"Tüsside, Road Road Street, Barış Mahallesi, Gebze, Kocaeli, Región de Marmara, Turquía, Turquía",,,
48h,40.79797,29.47406,337.69,19 de agosto,"Peace Neighborhood, Gebze, Kocaeli, Región de Marmara, Türkiye",,,
48h,39.66328,16.25975,335.46,19 de agosto,"Strada Statale 283 del Terme Luigiane, Tarsia, Cosenza, Calabria, 87019, Italia",,,
48h,40.05004,18.09955,339.79,19 de agosto,"Contrada Lamia, Parabita, Lecce, Puglia, 73052, Italia",,,
48h,40.08932,18.24192,340.26,19 de agosto,"Provincial Road Shirt-Gallipoli, Maglie, Lecce, Puglia, 73024, Italia",,,
48h,40.15923,18.31837,340.63,19 de agosto,"Provincial Road Cursi - Carpignano, Cursi, Lecce, Puglia, 73024, Italia",,,
48h,40.16269,18.31763,340.96,19 de agosto,"Cursi, Lecce, Puglia, 73025, Italia",,,
48h,40.9066,26.04779,330.11,19 de agosto,"Pine, Municipio de Alexandroupolis, Unidad Regional de Evros, región de Macedonia y Tracia del este, Administración descentralizada de Macedonia - Tracia, 681 00, Grecia",,,
48h,40.91259,26.06324,345.48,19 de agosto,"Loutros - Dadia, Municipio de Alexandroupolis, Unidad Regional de Evros, Región de Macedonia Oriental y Tracia, Administración descentralizada de Macedonia - Tracia, Grecia",,,
48h,40.91214,26.05525,334.75,19 de agosto,"Loutros - Dadia, Loutros, municipio de Alexandroupolis, Unidad Regional de Evros, Región de Macedonia y Tracia del este, Administración descentralizada de Macedonia - Tracia, 681 00, Grecia",,,
48h,40.91651,26.04216,338.99,19 de agosto,"Nipza, Municipio de Alexandroupolis, Unidad Regional de Evros, Región de Macedonia Oriental y Tracia, Administración descentralizada de Macedonia - Tracia, 681 00, Grecia",,,
48h,40.92385,26.08107,367,19 de agosto,"Pylea, Municipio de Alexandroupolis, Unidad Regional de Evros, región de Macedonia y Tracia del este, Administración descentralizada de Macedonia - Tracia, 685 00, Grecia",,,
48h,40.92231,26.05415,355.28,19 de agosto,"Egnatia Odos, Nipza, municipio de Alexandroupolis, Unidad Regional de Evros, región de Macedonia y Tracia del este, Administración descentralizada de Macedonia - Tracia, 681 00, Grecia",,,
48h,41.01922,26.57026,367,19 de agosto,"Ipsala, Edirne, región de Marmara, 22400, Türkiye",,,
48h,41.0302,26.57837,338.57,19 de agosto,"Kozköy, Keşan, Edirne, Región de Marmara, Türkiye",,,
48h,40.95708,23.19287,335,19 de agosto,"Lachanas - Eptalofos, Lachanas, Municipio de Lagada, Unidad Regional de Thessaloniki, Región de Macedonia Central, Administración descentralizada de Macedonia - Tracia, 570 17, Grecia",,,
48h,40.961,23.18688,342.43,19 de agosto,"Paliokastro Lachana, Lachanas - Eptalofos, Lachanas, Municipio de Lagada, Unidad Regional de Thesaloniki, Región de Macedonia Central, Administración descentralizada de Macedonia - Tracia, 570 17, Grecia",,,
48h,40.45371,18.08344,335.82,19 de agosto,"Squinzano Provincial Road para Archpriest Masseria y Caretti Alla Surbo - Casalabate, Lecce, Puglia, 73018, Italia",,,
48h,40.53074,17.84213,344.42,19 de agosto,"Mesagne, Brindisi, Puglia, 72023, Italia",,,
48h,40.48857,17.44519,339.96,19 de agosto,"Grottaglie, Taranto, Puglia, 74023, Italia",,,
48h,40.42183,16.84352,338.73,19 de agosto,"Ginosa, Taranto, Puglia, 74025, Italia",,,
48h,40.52702,17.28668,336.97,19 de agosto,"Via Alcide de Gasperi, Distrito de Paolo VI, Taranto, Puglia, 74123, Italia",,,
48h,40.65145,17.02158,340.56,19 de agosto,"State Road 100 de Gioia del Colle, Mottola, Taranto, Puglia, 74017, Italia",,,
48h,40.72581,16.5125,336.6,19 de agosto,"Matera, Basilicata, 75100, Italia",,,
48h,40.74024,16.3241,349.65,19 de agosto,"Irsina, Matera, Basilicata, 75022, Italia",,,
